869	A18RO1TUN7N8HG	1358121600	B00163JVJQ B003YBP0N4 B004D24818 B004I5RU2Y B006HWGSEM	B000O5RVJO-1 B000UGVVHK-0 B001UTI7ZK-0 B000RYSXWG-0 B007DGRT3K-0
4045	A23VRUYMB0MMFC	1358121600	B005KCAGEI B004DGLCFE B0058X0JIM B003G0S7S8 B005JRT7A8 B001HKR6WM B000GDDKJO B003I6MLN2	B000VRTE9A-1 B00AEM0W70-0 B000BX1Z00-0 B00D5MQHCK-0 B0043D4FPQ-0
6425	A2R6G4MSK71KHZ	1358121600	B000NUTUMQ B004RS87RY B001VJVP0S B000MAOWOS B005SM8CT6 B003FP86SK B0047HGD4E B001E724CA B000ZMBSPE	B00889VG6W-1 B003VMV7D8-0 B00893SY5S-0 B000052ZBH-0 B004UMYEIS-0
12006	AI5CX6Y1WT21V	1358121600	B001KYVVVC B004HSO124 B0068Y6CA4 B001KYO08S B004Z40048 B0064X6DC6	B001KYRRSI-1 B009ZRFJFA-0 B000E7YL1I-0 B000AAAW9Y-0 B001KYO7OA-0
3532	A1Z26BI583USZ4	1358121600	B001ET734C B001BR97A0 B000PK4XRQ B0001ZA3Y2	B000REOEYM-1 B005IAVBMI-0 B0017KGOY8-0 B004TSF8R4-0 B000O5RVJO-0
1244	A1CL5QGGKWH3BL	1358121600	B00120U5D4 B0016ZNWMG B000TK99NU B0000ZHOEU	B00005NASR-1 B000EM79QM-0 B000X1LOJM-0 B0006Q3O3S-0 B003OH0KBA-0
11086	A96ELROLQRPAE	1358035200	B005TI2AAQ B005TI2AII B007DGRT3K B002DQMZ5M B007DGRRG4 B007DGUREI	B0086LC0L2-1 B008QMPTSM-0 B00AYOHWQW-0 B008QMPTSM-0 B0033AYPXC-0
4998	A2DALFBECQH1SO	1358035200	B000R9C0PW B0019TYZ66 B0017P35JU B001AXIWGA B0059GQYGY B000142FVW	B00502NMTE-1 B002H5G1OK-0 B004HXXO1I-0 B00120IJSC-0 B006I33WQM-0
4809	A2BIGH7LHGX9WZ	1358035200	B000AQI2EK B000WBLYQG B0001TJX2Q B000SSG0EE B0000YV83O	B0020JESMU-1 B0030HFX9S-0 B0010ERASK-0 B003XUMQ7E-0 B001DI776S-0
11019	A8LSIIRD8NAGT	1358035200	B002RS6KV6 B0019Z8HT6 B0012IXO4I B002P9O45Q B0059JS2PC	B004MUG8V4-1 B007OT1R7K-0 B005TKZS76-0 B008BCNL3C-0 B003QKL5YQ-0
3880	A22CO9HAQEIRG0	1358035200	B003M57E9A B008UEXNW0 B004HYRH06 B001D3O18U	B000HRVC5I-1 B003XUMQ56-0 B001E6EME4-0 B007AS626G-0 B002QXINAS-0
7257	A2Z99UFI919U35	1357948800	B0037LEKDW B000Z91JAQ B001MW4VXW B004BCXEF6	B000ZMBSPE-1 B003IUGO5E-0 B0002Z8MLC-0 B00A8049SG-0 B00027EG9C-0
11100	A9D25J81K1ZSB	1357948800	B006QO4BRM B006EPIJTE B004NMTMUK B007TLJP2W	B003VMU63K-1 B000NWGCZ2-0 B000SDI6MI-0 B0017HOMWM-0 B001G7OCSM-0
6958	A2WHV0YLBOK0I0	1357948800	B001G9APMC B002LB75AO B000F0QCWA B001B1831U B0018DAUKI B000N8DMIQ	B003LDMVNM-1 B005ISB0W6-0 B003KPIIKQ-0 B000056W74-0 B001RMP7M6-0
468	A14R9XMZVJ6INB	1357948800	B000UPXU2A B0010A9RYO B000US0804 B000VPPUEA B001EWETAK B0027CT5SC B000Q2RP7I B005DKJRTC B002PBAJ4Y	B001QT5FMM-1 B00C0HF1J6-0 B007DGUREI-0 B005P02U8A-0 B0050I2VTA-0
11952	AHO98BSDQCF13	1357948800	B0064X6DC6 B004A7OVBI B00027D8IC B009Q1YPVY B007DKV8OW	B005FYJB92-1 B003JOF52W-0 B008MAU8XY-0 B0011DQMHA-0 B001UE60E0-0
4788	A2BCB516A8HV6K	1357948800	B001IACZEK B000I20Q72 B0000CNR0E B004V928GA B002HWS7UY B000UR90OK B000WI0640	B000TTPZQ6-1 B0007506U2-0 B000C1UCTQ-0 B002KANXHK-0 B00AYARK2C-0
10876	A74B88P9JIXPR	1357948800	B004M7WKKK B006MRM2TW B0030HMQTS B005LQRYKM B005UBN3L2	B0009JQFF6-1 B008Q0E714-0 B0009MMK5M-0 B000NE6PCA-0 B0059U4AQ6-0
10285	A3TAPHJCC3ADQU	1357862400	B00838FLXW B006HWGSEM B004NMF63W B0018ZRTZA	B007KNAA2S-1 B005OZF1S2-0 B000XT89S8-0 B00129XP8M-0 B005Z446JC-0
1930	A1JI36J86PPEQ5	1357862400	B000L596FE B0049MFMXK B001HKR6WM B004LUZ956	B0029ERWH4-1 B004SSDH6E-0 B002BFY9VS-0 B002QI1F8A-0 B001G7OCSM-0
8925	A3G6A3KNKGM6L5	1357862400	B00008J2XQ B000W96VLQ B0000536EW B001E96L72	B00112TIE0-1 B001KUTR9E-0 B001KUTR9E-0 B00119MI4U-0 B0042X83UA-0
6711	A2U1QEK4LLDFU4	1357862400	B0011V0QIS B00027DMI8 B00387F42Q B005I2MP62 B0009RFB76	B003QU26ZI-1 B007NXZ0T8-0 B0045W4X16-0 B00B7MUJR4-0 B000KOM08Q-0
1916	A1JEA7U282WD4	1357862400	B007Y06Z4O B003QITYNC B00381A7OW B001OOLONI	B004K6ZJNI-1 B007WR91L8-0 B000GHVCM2-0 B004HCI9JQ-0 B005M05558-0
12664	AOU7WF30CINTS	1357776000	B0097G3XDY B004OGB21M B00120IJSC B006MRM2TW	B001AFIWEA-1 B00C7PQM3K-0 B000QURQQU-0 B0009RMN0E-0 B0009RMN0E-0
4532	A28RREP03HJZGU	1357776000	B0062GZB4Q B005C48WB8 B002QI1F8A B001MX89Y8 B003TNVSTW B004Q8GYES	B000V6DMUS-1 B001TAIFZM-0 B00G0EJYFW-0 B0032CDFCS-0 B002RT71S6-0
11045	A8T6DPNZ7T0VX	1357776000	B001BSJ2PO B00479VTG4 B00171ARH2 B00198ZPU2 B0080HEARE B000OYJ9AO	B0009F3O8Q-1 B007NTYUGG-0 B006UETRWC-0 B004DK5CCY-0 B009JJA49U-0
11003	A8ETLTRXQWLG9	1357776000	B00147FGJ8 B0013TM9UQ B0009ION0G B000Y1JT8E B001N3FBZW B000PLUZL8 B005S10A6A	B00795XKXS-1 B0027SXG9K-0 B0027SXG9K-0 B005356O34-0 B0064M5JBI-0
9263	A3JFGQ8CISNRJ1	1357689600	B009ARXD12 B0058L24O6 B009ARXDHQ B002RGMI6Y	B000XSF1X0-1 B00AC3G0ZY-0 B002ZTV9SG-0 B007JXLT9M-0 B00AQ9QMQG-0
2199	A1MC28DIBVLRXW	1357689600	B000FBK5HW B003I6O5RC B000RN0J9W B000JL3U1Q	B00AMYORHQ-1 B0002Z1JJ4-0 B00AQ9JIDK-0 B00893SY5S-0 B004NYTR8U-0
1143	A1BJLYFJ6EYP4P	1357689600	B0009V1YS2 B001CJFEYK B006QO4BRM B003Q3RUTM	B0057JCYYE-1 B000VW7P3W-0 B000U2AQNY-0 B001GIOV82-0 B00021DPHW-0
1596	A1GCOURMTPXKWI	1357689600	B002HK2GWG B000LOGSVU B000MXHG66 B000KONYJK B004GC2LLE B000NNDNYY B000KONYPY	B00008KA8D-1 B003GMS8NK-0 B002WEBTPW-0 B0009VIJV2-0 B003XUMQ7E-0
9832	A3P37585DIKURI	1357689600	B000E8PG98 B001RMP7M6 B000ELP5KA B0030HMQTS	B001XVYBGO-1 B004Z5H0XG-0 B0048O2R1E-0 B00267AETM-0 B005IAWL22-0
9083	A3HM7UFESAMWLW	1357689600	B000MXHG66 B00014FTTM B00143S6YO B005XP4YNQ	B00178TVXG-1 B008KYB8QS-0 B0006B66D8-0 B002KANXHK-0 B0081E6X3U-0
106	A10Y9LFN8CSFH	1357603200	B001RMP7M6 B003VMXOXO B0061YRVOC B004SSFE8S	B004IR6TY2-1 B000RRKCVS-0 B00198PV7Y-0 B004BUDK6G-0 B000OY3WNO-0
5183	A2F866KJ962NCM	1357603200	B0042PEBMM B00385WMJ6 B001DTZK0C B004BE4JS0 B001189I3A	B002QGO5YS-1 B003UYZ9XQ-0 B000XZSVQC-0 B0043ZJQSA-0 B00428EJXU-0
8707	A3E3GD3TABXKU1	1357603200	B000UPXU2A B00127U7QM B001EWETAK B001J2ZXMI B0027CT5TG	B009VGNYFM-1 B005HIH738-0 B00AYCOLMC-0 B001RS8NQW-0 B00EB10Q1W-0
10628	A4LKXHDQYJTG8	1357603200	B004ZWMDZ4 B0022PG9G0 B000NOFZTY B000TGCJWC	B005FYJB92-1 B00AV1IJME-0 B005EII104-0 B000E793P2-0 B000P20RPQ-0
6360	A2QG0KKKVFD2AB	1357516800	B000052Y25 B006X1LOQO B001HTYJLO B0035RGZH2 B001EJOPTS	B001E5EBCS-1 B001U02HNC-0 B000FGC99Y-0 B00979C5EE-0 B006OMHTMK-0
12175	AJWD2KH4ARL8E	1357516800	B003OGT4KE B001RMP7M6 B004SXTF38 B000G7XRCA	B004LEJ8R2-1 B0085SOW1M-0 B000C20ZS8-0 B000C20ZS8-0 B003PFBCTU-0
6926	A2W43L976C8ACL	1357516800	B006UETAB0 B0037BQKTO B007N1D4A2 B000VHH712	B000L596FE-1 B004P2RZUC-0 B0045W4X16-0 B004VMGU8E-0 B00A7FS2OO-0
1694	A1HBCGM1JQMF39	1357516800	B002UN9F5G B003I3B3YI B0057JCYYE B0018C0HLQ B003VMZTCI B002NBF8SI	B003VMM74Q-1 B0007WL21M-0 B005GVY48M-0 B001ET788S-0 B002PBEAYE-0
4052	A23Z9R8VEYWG3U	1357516800	B0076P7R1W B000C1VX6M B000C1Z2D2 B0056Z278M B000P41F8W	B000C219QA-1 B0064M5JBI-0 B007IVTA0U-0 B006ZBKH2Y-0 B005IJTKFY-0
11330	ABN1M8NU0X8BX	1357516800	B0018SAJ7M B0002BB3YO B0018S6MO6 B001MUH190 B004BVYT2Y	B002LHG9HI-1 B005JYP96W-0 B000TYGI3U-0 B006Z43V38-0 B001EM1BBK-0
9087	A3HNCGMJANCQTH	1357516800	B002Y1Y1I0 B003E84PQU B005356O34 B001T8QJM0	B004BPVF7W-1 B004UA2RYI-0 B006Z43V38-0 B00267AETM-0 B0002JKQ8K-0
667	A16W1JWR3XRSEZ	1357516800	B000NLJFNY B006NMY0MS B002QGDBIO B004LV82JU B006QFM89Y B00D1G8XA4 B004BVYT2Y B0026OYLS0 B0009R33U8 B0039XT498 B000PZDRNM B0068Y6CA4	B0026J10CU-1 B002CL6D56-0 B0006OU06E-0 B00A6UH0GG-0 B002KAGWYQ-0
11258	AAYJA4GME03V6	1357516800	B001ET6XCA B0046MLZLG B0017P7BOA B000W7PKU6 B0000534VO B000P9DS4Q B000QWP2KA	B000052YP6-1 B005AKBUEA-0 B002BWPXGQ-0 B002RT70Y6-0 B002UUT38I-0
6294	A2PNJFSUPPD30I	1357516800	B002QI1E9K B003S516XO B004TSFE28 B004NYSL9Q B002ACKDU8	B001MA0QY2-1 B00112DUFS-0 B002B4LUF2-0 B003CIJE4U-0 B00005321Z-0
10444	A3UUJBMWCK2QIQ	1357516800	B001S261Q6 B003I5SC22 B0001TMDF0 B0016BFOVM	B003M6AS4C-1 B002HEW8FW-0 B001KYQ3DS-0 B001KYQ3DS-0 B00BRGR752-0
3709	A20VCWHGDIAOJI	1357516800	B002QAV560 B002WEBTPW B002UBVZYC B005HJ4474	B004SP12LE-1 B004DIXYUI-0 B001ADQUWS-0 B004HSO124-0 B00538EAAK-0
8437	A3B3D10S3SHYFF	1357430400	B0048ICI3C B001QT3GVO B000PLS9YS B003JNMPLC B0019XZ57U	B0077S35WS-1 B000TNQVPG-0 B0020MMCZW-0 B00CM7YTO2-0 B00008O2X5-0
6717	A2U4D3B7GD55FC	1357430400	B003FBI9LS B002LB75AO B000142FVW B002HK2GOO	B001H928HQ-1 B00397SNMS-0 B0045W22SW-0 B0055Q6MYM-0 B004FAJFDO-0
11621	AEC2A39TRSSDU	1357430400	B0006NYDOU B003TO3UG0 B000KFX10G B0018DAUKI	B004P2RZUC-1 B002QXINAS-0 B005JV1YRI-0 B006ZENPYS-0 B008QWW9GM-0
12474	AMYBVJ1JP667H	1357430400	B00120IJSC B006MRM2P6 B001DHI0R4 B005WTKB2Q B001D67O3G B002YFN49I B002Z64W5Q B0006M5566 B000WI0640 B004S2G4FG B0036QQWAC B00004TUBV	B008BDQKQQ-1 B001E96MZ8-0 B004RS87RY-0 B0027TZPVQ-0 B00AZBWA5W-0
4424	A27NY17IFFPOCJ	1357430400	B004016SXI B001H270RQ B000EM79QM B0009EXOP0	B0015UQBHU-1 B008FZ562E-0 B004ZN7PP6-0 B004WPWOS0-0 B006VDRQEI-0
13274	AUUUYUNME76KQ	1357430400	B000RGZK02 B002K8W58K B001JKTTVQ B004DIXYWG B003H83U36	B004Y4JNZ6-1 B005YB36RY-0 B000FBNYSY-0 B0035RE2TA-0 B00CFNMZ7Q-0
11601	AE7SUS4YOMNQJ	1357430400	B005XCCE4A B005BIO4Q2 B0068Y6CA4 B00027CDY2 B00027CDYM B005K49Y4Y B000GCWP28 B001T8JLRK B002N6SBJ6	B0023A7JF4-1 B001UHSVOY-0 B00BUMDR1Q-0 B0007V6PFQ-0 B002GCKVJA-0
7763	A34EKK2954RCMR	1357430400	B0015XNAS0 B005V2LLXC B005BG02BU B00631JA8S B000V2F9RQ B0027A7CLG	B004DK0UDA-1 B00BUSYXJU-0 B0027SXG9K-0 B0058KIAHC-0 B00AILKE6G-0
11190	AA9UTGNMCBM8Z	1357430400	B000OV3ZDO B002V9X78U B000VPPUEA B003AJJTXM	B004DHYZU2-1 B001DJDP7C-0 B009Q1YPVY-0 B008O4YM4Y-0 B00005V5OU-0
8786	A3EUBP0WZY8S0A	1357430400	B005BF1M10 B005X2F7JY B005X2F7KI B004DK0UDA	B004N2EYY4-1 B00028OC4K-0 B0043TR2JQ-0 B008HODSNW-0 B001707IQ6-0
8484	A3BN5Z996H9TZQ	1357344000	B002DP19ZU B000U0F9GA B004S9SEWK B006ON74II	B007KJ04EG-1 B004BCVG1U-0 B004DIXYUI-0 B004C6ZC5G-0 B004C6ZC5G-0
12937	ARHYQ02LV2UMD	1357344000	B000J41MNG B003COAFPQ B007XJM9EQ B002EKD768	B006KA23MM-1 B000ULRD1S-0 B001AO0WCG-0 B0000950LF-0 B0048CAUTC-0
3420	A1Y34W3HQJQ2RH	1357344000	B001EJOPV6 B0009V1YR8 B000KPSSJK B0013OXHYI B000052YM7 B0010JREC2 B003VFI0XU B00137B2S8 B002RL8IYA B003654SVS	B003TU4CB6-1 B00A9MKPT0-0 B002CL6D56-0 B00A9MKPT0-0 B00AILKE6G-0
8419	A3AWQKDAUDM3AU	1357344000	B0011DUE9C B003V57Q5I B003TA799S B001QT3GOQ	B00117CH5M-1 B001F0R25A-0 B0017HOMWM-0 B004YWS430-0 B001AD0HL8-0
13633	AYEDFWV2FZ22V	1357257600	B002NV8Y3E B000146LKS B00008CMOS B00112DRHY	B000052YJM-1 B001KYRVSO-0 B000WE1PP8-0 B007L86026-0 B000R80ZTQ-0
5860	A2LQMEI08F4KT8	1357257600	B0036FTF5W B000142C1A B0034E702U B000RLXG6W	B000AAC8VO-1 B002B4EF9U-0 B007OT1OPU-0 B008FXLRB0-0 B009YJESAG-0
10005	A3QOMCD4KATUW0	1357257600	B0017K81TY B004BCT7A2 B000RGZK02 B000F65JSC	B006UETRWC-1 B0001TMDF0-0 B00161I2NO-0 B00A6UH0GG-0 B00884GXE2-0
2253	A1MQT9DYCXXXK2	1357257600	B001J2ZXMI B001LF4G44 B0027CT5SC B00006598X B003VUAOOI	B0028S0V1K-1 B000FGDIAS-0 B001MBLAKA-0 B005SUN1SK-0 B001AV4D7Y-0
12534	ANM9IAV3DHW11	1357257600	B003SSTL42 B006VDSO0I B005ELMXP0 B000X81832	B001PHFVPG-1 B003IMIWRK-0 B0094C4XOO-0 B000LGNQPY-0 B006J5V6ZI-0
8625	A3D3RVMADETDST	1357257600	B00329L8TS B006L1DNWY B00005A9WP B0083QNBCM	B006UMU4NK-1 B0086XX0AK-0 B001DKRM8O-0 B00CFNMZ7Q-0 B006QY3470-0
820	A18FX13YEIJZF6	1357257600	B00150LT40 B006L1DNWY B00283O7LK B008SPOKIW	B000VUYDJI-1 B001R2S8HM-0 B000F35R00-0 B0015IW3PG-0 B001MBLAKA-0
8691	A3DYINYJDYI51Y	1357171200	B002GENWU8 B00006JN4F B000RRKCVS B000NSQI4Q	B001SYWTFG-1 B001KYRWP6-0 B00A73BVP8-0 B0067F28ZW-0 B00B3MGWTM-0
6411	A2QYOFAZTDBYVV	1357171200	B0040BK082 B003VMW2B4 B003VMEUJ6 B005IXG9Y0	B004SSRSRS-1 B003156OJM-0 B000Q7XDR4-0 B00A73BVP8-0 B00A73BVP8-0
2799	A1S2IRG0BDFBFR	1357171200	B003N4ST94 B001189I3A B000GG13TU B0042P99WY B0000C0XL8 B0027UQDB6 B0027UUDFS B001I6NZ0W	B00020E1P8-1 B0026J10CU-0 B007L51ET8-0 B002CEV1W8-0 B0054Y0FAW-0
9199	A3ISZXEJH7CQWT	1357171200	B003BQ6QXK B000ZLVUYO B001MA0QY2 B006Z8BN02 B0045WBFAI	B000WZR1R8-1 B0002DLEJG-0 B004Y5M8QQ-0 B008QMWVP6-0 B0056GIKI2-0
12604	AO7JSE31LOCIM	1357171200	B0056UDXDK B001MWV40U B00124CQUA B0000Y3FRG	B004S2FY7K-1 B005AKBUEA-0 B0073SBABK-0 B002RS6JQW-0 B000H3O90C-0
10647	A4PRNH6HAMQIR	1357171200	B002UL10HY B002LHG9HI B0001TMDF0 B000HRVC5I B000NWDSAE	B0047HGD4E-1 B00112AH36-0 B002RW9C3A-0 B0030HKJ8I-0 B003CGTKUK-0
13766	AZYA6NBTF2843	1357171200	B002CL840S B005GMYPX0 B001KYPZRS B002PBLH3Q B0002B0R14 B001L413AU	B007FLIHES-1 B000FS05VG-0 B00027DMI8-0 B003TFINPC-0 B005JQQKXQ-0
12827	AQFDZKSUPFHAE	1357171200	B000052YMR B000Z91JAQ B00EDY0IJM B008HCWR6I	B005HIH7YM-1 B005N2ZLHW-0 B003VMFITM-0 B003VMFITM-0 B00161607O-0
1988	A1K4J6S618D4A5	1357171200	B003VMEUJ6 B003VN9FRW B000142FVW B000XFWO10	B005OZD9QS-1 B0014LLC3I-0 B001SAQBEA-0 B0014LLC3I-0 B0064ION50-0
6013	A2N4J214NMG8FN	1357084800	B001GF7W0Y B005EHHWPA B0091XPADY B0083HT86E	B002L6NZHG-1 B00AXSCX5O-0 B006LFO7KW-0 B00A73BVP8-0 B0013VY4AM-0
10469	A3V4827LOG1F0X	1357084800	B000EMDKG0 B000BX5FS8 B003JCLP6E B001MA0QY2	B000BX1Z00-1 B002ZNJI94-0 B004Z209HS-0 B003Q33LJ0-0 B009TAQAOW-0
6402	A2QV46NEKGX1LS	1357084800	B000B9N0N4 B000QUNEES B000QUKAUE B000UVZLHQ	B001HTCYPC-1 B00COVNG7W-0 B001AV4D7Y-0 B00CNWY1YY-0 B001D0IWDS-0
1275	A1CWG72R5RLVCR	1357084800	B001QOGXOG B006GACVYQ B004ZD2M6I B002BEHQWI	B004Z67NSM-1 B00027D0DU-0 B002JDUMFO-0 B005TKZS76-0 B005TKZS76-0
12707	AP7QJBMW3E8VN	1357084800	B000A409J8 B000EVEKMY B000CSYYZM B002GELXJK	B001841FKQ-1 B00017XWJ8-0 B0015IW3PG-0 B0065DLADM-0 B009SJ7DFE-0
8669	A3DM6JQJN0DX8V	1357084800	B007L86026 B006OMHR1S B005WTKB2Q B0052L1YZC B0060GFV3Y	B0017ZDH52-1 B004OUFZP2-0 B008O4YM4Y-0 B004YWS430-0 B004YWS430-0
3142	A1VOSV0YY10DDO	1357084800	B000ZMBSPE B000NSIGE6 B00008CMOQ B002LB75AO	B001ET734C-1 B007KNAA2S-0 B001E96LWM-0 B002WTC37A-0 B006MMOVOQ-0
3087	A1V275UOTJ1FAK	1356998400	B0064EJ44O B0049J7P3S B004DIZZ46 B004ZD2M6S	B005Z4QT7E-1 B005JFPGX2-0 B004Y9GY44-0 B005JFPGX2-0 B001WAKUTS-0
3016	A1UD2KJ166OBDK	1356998400	B003VMXOXO B0045K1N8E B004NN0FIW B004SSC738 B007S5BB8A B003VN00YY B004SSIW5K B003ZUZDD6 B0055E61KY B003VMZRYI	B003VMFITM-1 B0045WDQFA-0 B003TG9C74-0 B0045WDQFA-0 B003GRD5ZG-0
6129	A2O393A2RISC49	1356998400	B009JKDCEI B000PW7K38 B007XX4EYU B0071S7EWQ B001H270RQ	B0076HRUQC-1 B00006JT6O-0 B00BQMIGTI-0 B003YQIHK2-0 B004BCT7G6-0
13519	AX8Z7ECXAALH4	1356912000	B0017BI80K B007N16KOY B0018C0HLQ B000RBAPN4	B001GEEQ90-1 B001KYRRSI-0 B002WEBTPW-0 B007DGUREI-0 B001KYRRSI-0
1419	A1EJNO5RHV64YD	1356912000	B00147FGJ8 B003KZBI30 B00283SN92 B00264E23Y B0058E3XJI	B004T19R3W-1 B00363H8IU-0 B00363H8IU-0 B003XFKACM-0 B008DWSJ1O-0
1691	A1HAIYW6MYCCY8	1356912000	B00005A9WP B0023A7JF4 B0001TMDF0 B00196UB1M	B00120VWTK-1 B000HJ4INE-0 B004CEJTOS-0 B003X9E236-0 B008CEDY5O-0
1078	A1AS9O0JG1YJT5	1356912000	B0058E3XJI B00027DMI8 B005I2MP62 B006X1KROY	B006KXDWJC-1 B006RFZ66K-0 B004Y4JNZ6-0 B005EHHWPA-0 B006RFZ66K-0
11338	ABOP79Z7Q98WA	1356912000	B003XUMQWO B007CMS5C4 B005IUGXU8 B003VFI0XU B002WR58XS B0071H5C76 B001I6RW6U	B001BODO2A-1 B001P5WZE8-0 B003M57E9A-0 B005NVFW6S-0 B001TVURZW-0
9061	A3HFYNON7A53LI	1356912000	B005EHHWPA B0015GEMSE B0032K5YSI B000PQGYOU B002OVV7F0 B000PBQ7LK B001H270RQ B003G0S7S8	B001AL4DBA-1 B00283O7LK-0 B000C1VT0W-0 B000PY9HG4-0 B002XITY36-0
12417	AMHFVGVVBUS2K	1356912000	B000092OX4 B003BMNE4I B0000536P4 B000MVVK7E B002UUT3A6	B0081E6X3U-1 B004LCD8D4-0 B00027D0DU-0 B002S8RWYY-0 B008LQRMAQ-0
2733	A1RI7WJSWQW2CZ	1356912000	B004DIXYWG B008C130XS B002VECJV6 B000V9M8B4 B0063I3R9O B004PYL4NE B004X1QY20 B00005UQSP B008PQ5YAM	B001C1LBG8-1 B001A3ML3K-0 B0002Z8MLC-0 B002M7FHFM-0 B005C2NBC0-0
224	A1264R3PH7FG5S	1356825600	B00150LT40 B0000632EN B0009OAGZ6 B0019TX4MW B0009OAHVO	B000XTCFME-1 B004Y9GY44-0 B0000ZHH5G-0 B004N2EYY4-0 B001EUS8G8-0
11885	AGXPPT9EIPWDW	1356825600	B002TPQPEE B00150LT40 B0019QL0OY B00550JBQ4 B0018CQKXK	B0043IX95I-1 B004LXHEX8-0 B000C1VVF0-0 B007441K54-0 B009U9990E-0
8699	A3E1FNDF9MW0MS	1356825600	B002C794DS B00397XUIK B000VT2GYS B00787QT6W B005IAVBMI B00683MOWK B009VD3IHO	B001GEEQ90-1 B0076HRUQC-0 B002NBF8SI-0 B002NBF8SI-0 B00CZE85II-0
5350	A2GPFSX630LBVM	1356825600	B000142FVW B000WE1PP8 B0060ALFW6 B0071S7EWQ B00772CR82	B000O3BDHW-1 B0007V6PFQ-0 B002KJSD8K-0 B009YCEMU4-0 B009YCEMU4-0
493	A152I1BISLYNP9	1356825600	B0000532YN B000089SA4 B0010ERASK B003JTCYH6 B003JTF3VK B000Q44H9U B00099Z2OQ	B00014EH2C-1 B008CT12G2-0 B000F3ZSVI-0 B008CT12G2-0 B00CQ5C54G-0
5149	A2EW5F46BKR5Q6	1356825600	B002QXINAS B000CECSAO B004NYSL9Q B0027TSO5A	B009JKDCEI-1 B0006PJTB0-0 B00EA4MHN0-0 B00CRM2SUE-0 B000PW7K38-0
6173	A2OJBW3MHZIXMK	1356739200	B005OZGDO8 B005OZJYUS B002NN6WZE B001L413AU B007Q22HMY B000PHRIQM	B006J5V6ZI-1 B0056BUFPI-0 B003N41WWA-0 B005IUKUAC-0 B00142C8KS-0
3770	A21ER0WC4N99PQ	1356739200	B004DIXYWG B00AB4W2H4 B005UKZAJG B001JKTTVQ	B004675EI6-1 B00020E1P8-0 B000OFB5QO-0 B0028Q01Q2-0 B004FD5WO2-0
13513	AX79FLB4366SR	1356739200	B004SS8WWS B004SSFE8S B003VMU63K B0081SGUC0 B00644YNCM	B00469CIMO-1 B00AYOHWQW-0 B00A2Y02TI-0 B0027CT5SC-0 B00068AZ88-0
1030	A1ABZOGLHP3HAH	1356739200	B005BF1M10 B001E25G0W B000CECSAO B000O3BDHW B00150LT40	B0018OWHQM-1 B0000530O9-0 B004675EI6-0 B0009ET4VI-0 B000KVH1QU-0
2874	A1SW73W9CLXOBT	1356739200	B008DF6XXW B005HIH67A B000JF9Q1U B000142JDG B003JMWFK4 B0059GQYGY	B004S2G4FG-1 B002WEBTPW-0 B000GHVKEW-0 B004BCT7A2-0 B008STA7IK-0
11638	AEFGDAVF45JMC	1356652800	B004BYOE58 B004D58LWW B0062GZB4Q B000WI0640 B00129H6BO	B000056W74-1 B000ZLVUYO-0 B000X315P8-0 B00AAG9M2Q-0 B00A1Y177A-0
3857	A225NZT6CHVPB	1356652800	B002B9DWBC B00016WV6E B004OES6X6 B0041P4XTE B003YCAQDC B006UET9HK B002HPBF32	B0020YLEYK-1 B0037MDBMC-0 B000VUT3O8-0 B000P231AO-0 B000P231AO-0
10878	A74SYWCYTH6KS	1356652800	B000VDUOFM B0002PCH2M B00150LT40 B00008CMOQ B000142C1A	B000VUYDJI-1 B000H3EOLG-0 B007UQ90O4-0 B007UQ90O4-0 B009YJESAG-0
1684	A1H7B82JIIAHJP	1356652800	B0049WJA9C B000UPRSKA B003AFI8D8 B002VAZINQ	B001LVA0XO-1 B000MUQFTI-0 B000MUQFTI-0 B000IVB14A-0 B000IVB14A-0
5116	A2EJ9KKHRD92O7	1356652800	B004DIXYWG B001V85POQ B003WM4DXS B0000632EN B000V2J3ZK	B0018DAUKI-1 B00005O0MZ-0 B0027UUDFS-0 B001DI776S-0 B00DNK4Z96-0
1121	A1BBW2AZ49E4AR	1356652800	B000JWO7JO B000WNLFBI B001NYMTOC B00176WU7W B000TDG2PU B0012HMSC8	B000NWGCZ2-1 B000TYGI3U-0 B000V6DMUS-0 B0011DL6R6-0 B0045W4X16-0
5247	A2FSPD94H4SYE3	1356652800	B002P9O45Q B001VD8DDG B003X6EU72 B0076P7R1W B000FGC99Y B004V0SZNO B001TI8XBU	B000FGC99O-1 B000YTA4TO-0 B005XHEEZM-0 B001JQLNMI-0 B0000UTUW4-0
7189	A2YMRR7YLVOMWG	1356652800	B001GMANIK B00134O2C4 B0017KGOY8 B009Y2117G	B005EFNXBY-1 B000052WYD-0 B0007X74IQ-0 B0016A8DT8-0 B001841FKQ-0
11574	AE0EC4IUT7FT	1356652800	B007L5ISQ0 B000QAVNA0 B007L5P7YQ B007LA6CQS	B007L8QLU2-1 B00A78TEAM-0 B000VTVA7M-0 B002SFVP2W-0 B00A78TEAM-0
973	A19XAL6OXGM67A	1356652800	B00997YO52 B000QSDHPG B001J4IM5G B000QE6U54 B000HIYE0M B003HGOIOS B000TK99NU	B005K09UV0-1 B000U0DWIM-0 B001D67O3G-0 B00BCX34YI-0 B004GT440S-0
9831	A3P30LTMM9DJLP	1356652800	B001TAIFZM B0031B51Y0 B002W2N1J6 B004CQ710U B003T2V3FW	B006ZBP8NM-1 B00175X9WI-0 B006Y8N6NK-0 B0083QNBCM-0 B004NZ3D66-0
4655	A2A2C2T9GT9CG3	1356652800	B0060NZY7K B000MASTNI B000MASTMO B000MAOWOS B000EEBWJ0	B000CBXDRE-1 B000QSDHPG-0 B004X8KP9Q-0 B004L5NBSS-0 B000J41UO2-0
6654	A2TCL5DE4I4YBG	1356566400	B000VEMWB0 B000VEG964 B000VEN3RW B008LDFU26 B003VMU63K	B0057JCYYE-1 B002WR58XS-0 B0014272H2-0 B0034KYDSI-0 B005J5TO0S-0
4755	A2B0OM3NHAN2YS	1356566400	B007L5ISQ0 B007L9DRXK B007L7XQT2 B007L5P7YQ B001CB2OQO B000P7X1MC	B000QAVNA0-1 B007XAV626-0 B0017SWIU4-0 B001KYRNAK-0 B0007506U2-0
3766	A21DL39TBVCOF6	1356566400	B001CT0AGC B0012RSXNG B001WW8NFY B001MA0QY2	B0020MMCZW-1 B00027CDYM-0 B001CT0954-0 B004DKMJ7A-0 B002QF4UYY-0
946	A19LG3NCLGF8G2	1356566400	B007L5P7YQ B001CB2OQO B001C9QET4 B000P8559S	B000QAVNA0-1 B008AGWMEI-0 B001WAKUTS-0 B004W5M3LS-0 B002LFLPEC-0
621	A16EIA3UQG445T	1356566400	B007L5ISQ0 B000QAVNA0 B001C9QET4 B000P8559S B000P7X1MC	B000QAVLT8-1 B0017ZDH52-0 B004KS0ODG-0 B007RVHDAK-0 B001KYRWP6-0
8769	A3ENN12GLNTUAF	1356480000	B001ET77YI B0015IW3PG B001FWXI6U B004675EI6	B002TPQPEE-1 B0045W22SW-0 B0015A807Y-0 B000PQGYOU-0 B003FTXLZY-0
6174	A2OJE9T10KAN9U	1356480000	B001EM8MNA B005U33DO2 B0037ZH2T2 B0013TM9UQ	B0002SA9BU-1 B0015AABEE-0 B004LXHEX8-0 B0043TUSME-0 B008U1Q4DI-0
10262	A3T2PQ9A6S9VS1	1356480000	B000C1ZBYM B000C235LW B001CT0AGC B003B8G5IY	B0039VOSPU-1 B005OZF1S2-0 B000NWDSAE-0 B0055E61KY-0 B00468KRH8-0
10157	A3S3ZOYXE8T5BX	1356480000	B007OLQ80E B00795XKXS B000GDF48Y B000GDF498 B004O2KPRI B000GDC4HI	B00387F42Q-1 B000GCKCDW-0 B00BA09EJ2-0 B001E96PM8-0 B002L6NZ6C-0
3121	A1VJ16TJBHRRW	1356480000	B000BIXP62 B0037QGE9A B0000537NH B004L5NBSS	B001MV5TX4-1 B000I6KRIG-0 B000BD0SEE-0 B007XAV626-0 B00021DPHW-0
12897	AR3YM3HMHNNED	1356480000	B000OLAMGC B00021DJ32 B000EGMHKQ B003P85MAM B0014UAHQW	B001UE60E0-1 B004Y4JNZ6-0 B004Y4JNZ6-0 B002UH6U1O-0 B003C268NQ-0
10036	A3R165E0EU0OUZ	1356480000	B0009R5CMK B002EQZ9OU B0012NVE2W B000TKH6G2	B001T8OW4M-1 B0012UK304-0 B0050VKEWS-0 B001FS0HAY-0 B000REOEYM-0
1151	A1BN12O9JLKHXU	1356393600	B000F63TW0 B000092OX4 B000F63OG6 B000GXBGIG B000CSQV3A B000F4GIPM	B007L5H7XK-1 B005R3IPJI-0 B000L9YYTS-0 B003YM5RA4-0 B002PMLGOU-0
7035	A2X9XUZ85TDGRO	1356393600	B000OP3DIM B001O08CQY B00076X0BS B002FQKKBQ	B000B45BUE-1 B004V6BIZU-0 B000WNLFBI-0 B0012RV5UO-0 B00175X9WI-0
7172	A2YIKPOB8XHQR7	1356393600	B003HLTTJM B003EUR1D2 B004NFYU8Q B003PLJP2A B003EUP3O6 B003PL2D6A B00164FKWW	B003XUMQ56-1 B000XE906S-0 B001T8M9VA-0 B00B3TNLJE-0 B003H897AQ-0
9626	A3N3ZY9CUEPL3R	1356393600	B005JJ4GX4 B002WU6BL8 B0012RWOB8 B0040YRFAK B002KP1WIW	B0012RXW1O-1 B002HWS7RM-0 B001H928HQ-0 B000F37UNM-0 B004FMBU80-0
4787	A2BBZGVLEGIAVN	1356393600	B0034KYDTM B000VSYD4K B003AKZCQE B00065AFFE	B0024SCPOA-1 B00A7W13Q6-0 B001T8QJSO-0 B0007V6PFQ-0 B004OGB21M-0
12508	AN96RZ92SLGJV	1356393600	B00021DVCQ B0009OAI1S B0009OAI8G B000VBDWQC B000P276AK	B0009STDD8-1 B00BFM3HRU-0 B004T49ZEK-0 B005NBRX2O-0 B0013TM9UQ-0
6779	A2UQDB9VD2MZ4V	1356393600	B004ZH5MTS B0067F28ZW B0088JJ7YK B0058L24O6	B0061YRVNS-1 B001B1831U-0 B007TNHQOY-0 B005C5FP9Y-0 B008CC4I5Q-0
12117	AJ8G513FGG8VE	1356393600	B000VEMWB0 B00397XUIK B002CMLS50 B003VAIG3Y B0024WDWU2 B003COAFPQ B000VEN3RW B006ZBP8NM	B003CTVSKC-1 B002HEW8FW-0 B000F6Y55A-0 B002LHG9HI-0 B005XHEEZM-0
5236	A2FQ4934D6S0MA	1356393600	B001441QCW B001VA8PWI B00265YNFK B0034EAEBY B0006Q3O3S	B004GT440S-1 B000UGUB1W-0 B004V65RMU-0 B000PHKE0O-0 B004V65RMU-0
2325	A1NI2O2BZ0HVV5	1356393600	B000B5UPF4 B00170F6A6 B000FS05VG B002MSN3QQ B000UPRSKA	B000GX77NO-1 B0058NANJC-0 B0039YQG3E-0 B001KYRWP6-0 B0046ZOWJU-0
2117	A1LGXY1G23C6K0	1356307200	B0001TSWWS B00128WK4I B001G0UC1A B001A6N5GE	B007UUE824-1 B000J41UO2-0 B00A2Y3LD2-0 B004NMVP82-0 B000EM79QM-0
10078	A3RBES0V9KS9IN	1356307200	B002Y1Y1I0 B004Z2NPK6 B001KYO1QO B00021CNCK B006ZA0A5Y B006ZAPMT8	B002XHA5A8-1 B008DUCH4Q-0 B002HSWFWY-0 B002BS43HU-0 B002HSWFWY-0
3836	A220KBSBXWIFIG	1356307200	B005XCCE4A B001QD0OYM B004BD11DM B005WTKB2Q B002LFNQT4	B005GVY48M-1 B004S2G4FG-0 B0009WB49K-0 B004KPYWM8-0 B007HSP5GC-0
8735	A3ED8GX6J785A9	1356307200	B002TPQPEE B000P9DS4Q B004X1QY20 B003QAPTAW B0068Y6CA4 B005EHHWPA B007DKV8OW B005GMY81O	B004IC8WS8-1 B001MX89Y8-0 B0049MFMXK-0 B005V1TL12-0 B008T85MU8-0
7924	A35ZRVNYBA5BK8	1356220800	B000YG82HI B0002JGIZA B002MSN3QQ B00464EC1E B0032CDFCS B003RF82UK	B0009ET4VI-1 B000P4ZOIE-0 B002KPWZPG-0 B000P4ZOIE-0 B006QFM89Y-0
753	A17RHKSWSR3G7M	1356220800	B00397XUIK B001CMT83A B000BIZSV2 B004TSF8R4	B005HIH7YM-1 B000FCNW26-0 B0010EPQ36-0 B005X03V1W-0 B002N5MKMG-0
3451	A1YFMKO8JTHO2	1356220800	B0058L24O6 B001MX89Y8 B002XXB5FG B0049CERRC B001OOB6K4 B003UZ4R24 B0056AE8I4 B005Z6K2T8 B0000BV14G	B002LB75AO-1 B005U33DO2-0 B002UUT3A6-0 B005U33DO2-0 B00A1Y177A-0
5537	A2IN35J9LHU345	1356220800	B005KL3B64 B000HRVC5I B003824I2I B0001EL658	B00017XWJ8-1 B000FGDIAS-0 B0082D9SUK-0 B001EJOPV6-0 B0061H9RDM-0
7199	A2YR1V9QJRC2P1	1356220800	B000P1S0N8 B000050B6U B0019XZ57U B0034E702U	B0019CYZGI-1 B00113HO90-0 B001NG0TXI-0 B004S9SEWK-0 B0046MLZWU-0
10718	A5K6KPLRCXDVM	1356134400	B002CMLHF6 B003OIPJZ6 B002SPVA7M B001ET6XCA B000C1VVF0 B000C21BT0 B002IT3KD0 B001E96LCM B0032R48MO	B004DKMJ7A-1 B006ER6KB6-0 B008KPO2MY-0 B0009VNI40-0 B00B57TCA6-0
2012	A1KCIPXJGD6AKP	1356134400	B0028MITHO B00006JT6O B001PKXTWA B006YC3UP0	B0068Y0EXK-1 B004DK4CH0-0 B000RO3EMA-0 B001G0W96G-0 B00005NFBJ-0
6624	A2T270WXBVI9EV	1356048000	B000TKH6G2 B004K3D0FK B006Z8BN02 B001ET7BF8 B000NCTQV4	B004NFTGA8-1 B0018RF4IW-0 B00BEGEQKE-0 B005UBN3L2-0 B0036OJEFO-0
13449	AWIBW7GDLOKWC	1356048000	B0001EL658 B003XUMQ7E B001HTCYPC B000BX1Z00	B000VTVD6A-1 B000P22TUW-0 B002L6NZHG-0 B007FLIHES-0 B001UOLI4C-0
11841	AGEVRGK52SKSY	1356048000	B000ME2YWG B00194Q7BC B00535OW6A B0049ZBQZ0 B006RFZ66K B0046NPH0K B002KAGWYQ B002LB75AO	B000PZDRNM-1 B0016BLWEU-0 B000BH92J2-0 B001CT0AGC-0 B0022PG9G0-0
4195	A25BEP9L34GAMQ	1356048000	B000V2DLJO B000V2J3ZA B00005333I B002LE54P4	B000P22TUW-1 B00787QT6W-0 B004BPVF7W-0 B004SZ4KTK-0 B006MRM2TW-0
9615	A3N12MEIKIOLNO	1356048000	B0051SF376 B004M81IL6 B004GH99QO B000RGZK02 B004M7WKKK B000VBDWQC B002QB52W2 B000052Z8D B006QHXDKK B007LANY2S B002QI1F8A B004MGAGP2	B00007M0CP-1 B003ZZQ2JA-0 B000V1QLEM-0 B0022077CK-0 B00AUFS8I6-0
4744	A2AWZ38VL5MQ37	1356048000	B0018DAUKI B002QI1E9K B0009RFB76 B000WOU3I8	B004QLOFTG-1 B00CBT0TYU-0 B001ET788S-0 B0036Z0HL8-0 B002SV0XYW-0
13592	AXZHYK5SXNNXK	1356048000	B003VMVBVG B000AA5VZY B004O6Y39U B007TLJP2W B0084BPHY6 B000KEOO3U B00644YNCM	B005WTKB2Q-1 B0034KYDTM-0 B001B7MAU4-0 B0030HAF4G-0 B002VAZINQ-0
931	A19FIMFMV2BYV4	1356048000	B0056GIKI2 B0019N6RFO B00150LT40 B003G0S7S8 B005VX8S4G B006OMHTXO	B009NCM6JY-1 B000H8UN3Y-0 B005T306QG-0 B00AU8SXII-0 B002HEW7Z8-0
9594	A3MTZRNTVZ30YK	1355961600	B0017R7TYK B0046VIGPU B003BR4LBS B000F8HWXU	B005OZH88I-1 B000PZDRNM-0 B000A3V1XC-0 B005NVFW6S-0 B00006598X-0
8230	A3947TAS2670M1	1355961600	B000C1Z6DS B003M1PY2S B003VMW2B4 B001HYHUY2	B0063TFLG0-1 B004DK5CCY-0 B00397SNMS-0 B001D0CWQG-0 B0054GBXOW-0
13727	AZFRZ3WVS46OR	1355961600	B001JKTTVQ B000NBMEVY B000C1Z6DS B0024H42E2	B003WXSDV0-1 B0002RI2PG-0 B000PLS9YS-0 B000PR4F9K-0 B000XE1TUI-0
7497	A31NK65672UL9N	1355961600	B000NGI4QI B0009EXM52 B001E23YV0 B002YFN49I	B004A7VFWG-1 B000GHVCM2-0 B00AS5GHKO-0 B000PHISKW-0 B00021DJ32-0
312	A133WTKECXJX7K	1355961600	B004XJNQXW B004YF5M0U B0082XRJXS B006OMHR1S B005FK3M46	B009NCM6JY-1 B0009F3O8Q-0 B004AIAVYS-0 B001ESOKOY-0 B0009VIJV2-0
4289	A26BZ1JTONRPGB	1355961600	B003VGMOR2 B003VMAL5I B002VAZINQ B0057WJ264	B001ET7JC8-1 B006UMU4NK-0 B004I5DFYQ-0 B001P1ZEMC-0 B001SXPSD2-0
10060	A3R6218V6A2K30	1355961600	B003VMTZ8C B003VGMOR2 B0045K1N8E B0076H8R8C B0030HKJ8I	B00021DG80-1 B00387F42Q-0 B000UF5TQK-0 B00387F42Q-0 B0056BUFPI-0
10774	A62YLUD4BHI1Y	1355875200	B000BYQBT4 B0002NIAC0 B006X1DCFK B000H9C1UG B000VEMWB0	B000OYJ9AO-1 B000KEOO3U-0 B005SPETHW-0 B000C1VX5S-0 B004C6ZC5G-0
