12068	AISIZ4XU4PDSV	1369094400	B003282VZE B001QT3GVO B0043OWJG2 B0018SAJAY B00DM14TYC	B003RF82UK-1 B0038YW3BY-0 B002B4EF9U-0 B0085YA6K2-0 B004I24AMK-0
13410	AW4FU1S6YY6MW	1369094400	B000C1ZDTU B002KFOX38 B004X9BRRO B005SHR4LS	B006X2IMGS-1 B002N5MKMG-0 B007FI5QT0-0 B00142C8KS-0 B004OUFZP2-0
7228	A2Z0VI725YTJQ8	1369094400	B0080GV0Z0 B0082XRJXS B000VUYDJI B008Q0E714 B004DK0UDA B002SIKCNW B00A2Y3LD2 B00A1Y177A	B006L1DNWY-1 B00B0ZQWH4-0 B007AS62J8-0 B000JVA80C-0 B000JVA80C-0
3755	A21ACKP1NWDCDJ	1369094400	B000EVGOQY B00910ZHJE B002XHFIM8 B005BF1M10 B00912CL5K	B001CE6T76-1 B004ZD2M6I-0 B0051SDC2Y-0 B0018ZPZJC-0 B0012J138G-0
8157	A38GZDHGZASCYH	1369094400	B000AM82US B00008J2XQ B000TKH6FI B000NE6PCA B000HJ0ICY	B000RLXG6W-1 B000SJ9G0I-0 B0006LNC2G-0 B0009OAHQY-0 B000U4WNC4-0
3562	A1ZAFZO6DFHGB3	1369094400	B0013N5XAU B0000531II B002L6PXNA B002Y1Y1I0 B004NYWR7S B001BMLJU6	B002XHFIM8-1 B003PL9ONU-0 B003LYDBCG-0 B0096WUELS-0 B0018C1FKI-0
7923	A35Z0822SDGZEI	1369094400	B002HEW8QQ B001RMP7M6 B006R3CORG B00468KRH8 B007AU0FXA	B005J5TO0S-1 B005V1TL12-0 B005HR7Q6M-0 B008MAU8XY-0 B00CA05FO4-0
4279	A268SGYAWBGUZR	1369008000	B0032PQPWW B009TUSP1S B00AZBUAP4 B005Y848A6	B0051SDC2Y-1 B004V65RMU-0 B000OYNCES-0 B001DNZJW2-0 B001A4H756-0
6231	A2P2CE8EACYO7R	1369008000	B005M05558 B0033VVJSK B004TSFE28 B00AF0TGFA	B002R23I76-1 B000XFWO10-0 B000XFWO10-0 B007N0FYX8-0 B000EM79QM-0
2069	A1L1G43JLNJR3Y	1369008000	B000EGIFBQ B0009R33U8 B000ZMBSPE B007867TQW	B000Y1JT8E-1 B0036B3C0A-0 B001CJMLHS-0 B004WLN4U6-0 B001E6EME4-0
1474	A1F4VZTFI8J1UN	1369008000	B002WTC38O B004887CU6 B000N043DW B002B649V2 B006ZBP8NM	B004NMF63W-1 B004MTJJDE-0 B004530AB2-0 B004MTJJDE-0 B001ADOV4W-0
3914	A22NETHJ4KTWJP	1369008000	B002WLWX82 B0086LC0BW B008RTNSJQ B007N16KOY	B00011QTZI-1 B001T8MTV0-0 B0045K1N8E-0 B005EYSKQS-0 B008SGKHEW-0
7354	A30BSUNEZYZU5T	1369008000	B001CE6T76 B00BTFKGNG B0056FL4FY B002NWMN26 B005C1C02S B00AZBSPQA	B001G3VA22-1 B000ZLVUYO-0 B001AN0UTC-0 B001AN0UTC-0 B0039PZQ2U-0
5029	A2DK6WLI2Q0FCL	1369008000	B005OZFV50 B002R23I76 B0067F8BBM B0002F1H6E B005GYL9C8	B00B8P5CTA-1 B008BS9YNC-0 B005JYP96W-0 B005T306QG-0 B002RS6JPI-0
3754	A219J1R4Z4BF7R	1369008000	B001T8JLRK B002RS8MWG B002LHG9HI B0012RSXNG B005N2ZLHW	B007XAV626-1 B00DQ2IMVS-0 B002Q6UK9M-0 B009YSTOE2-0 B0014WKHT2-0
426	A14GS4919RSRTU	1369008000	B006EOCS1U B00578Y7YK B003VMU63K B003VMZTCI B00469CIMO	B000OFB5QO-1 B000WZ6P34-0 B0001433VI-0 B006UMU4NK-0 B0096WUELS-0
1986	A1K46B8FN58586	1369008000	B002UH6U1O B00871KNMY B009A0VGKY B0017BGQR2 B005C1C02S	B008U1Q4DI-1 B0078VTGOK-0 B0039BCT56-0 B002TLT3R4-0 B004ZLZ77G-0
2690	A1R3SW936ZRGMR	1369008000	B004BVYT2Y B001QOGXO6 B004E6IIE6 B002PMWPD6 B001QOP2KM B00787QT6W B000GDF48Y B00795XKXS B000GDF48O B002CML02Q B000GDA056	B0058KIAHC-1 B001P4FJ0G-0 B007XA49O8-0 B001G8WF1M-0 B004ZMTK1Y-0
6406	A2QX7Q03UN9WG2	1369008000	B001C60YA2 B0082XRJXS B000MI85FC B009NCM6JY B005FK3M46	B00CDGR29G-1 B006ER6KB6-0 B000L596FE-0 B006ER6KB6-0 B008BJ4SR8-0
13012	ASAMTXBXBILGZ	1369008000	B001RMP7M6 B003VMFITM B0018QO5CO B008VYF6B0 B0018ZPZJC	B000VTVA7M-1 B002JLQWNM-0 B004BD9152-0 B001EWET96-0 B000PQGYPY-0
5216	A2FKC43XAEV54L	1369008000	B0009OAI1S B000Q7UKC0 B008PK5NRC B007TA89ZM	B003OGT4KE-1 B000SI2T0S-0 B005Z49L7O-0 B0011ULXB8-0 B004L96NZW-0
11339	ABOT9KWIWRPQX	1369008000	B007Q22HMY B004ZH5MTS B0069UA4GK B000NN7FSO	B004DIXYUI-1 B00DQUVXPW-0 B00119MI4U-0 B000NPWQU4-0 B002PBLH6I-0
4239	A25SL8Z18FXECB	1369008000	B000142FVW B002OVV7F0 B005FYJB92 B003F2T0M4 B004A7VF58 B004LXHEX8 B002QI1F8A B003ICXD4M B000LPJASC B003Y55NXM	B001H0YT5Y-1 B008K2EG50-0 B004GT0CFY-0 B002F17ZXW-0 B004GT0CFY-0
2935	A1TJ1H7Q2KP543	1369008000	B00AU82TP6 B001KYQ6QM B00113HO90 B002PBEAYE B000QA7HNC	B0000AJ3PU-1 B000Q44H9U-0 B004UM38V2-0 B0017HOMWM-0 B00365DABC-0
6637	A2T5LJZSAUH3O6	1368921600	B009ARXD12 B0078VJ1OK B007N0FYX8 B0013CSGBE B004M7WKKK B0083JDFY8 B001HKR6WM B0083QNBCM B004MMUGY2 B0019N6RFO	B008TNPXMK-1 B000EVGQ8U-0 B0009RF9OG-0 B0001TODNK-0 B000G1MT2U-0
6249	A2P7AZDPZTX604	1368921600	B0071S7EWQ B000142FVW B004DQWIIO B00021B95W	B00BAVOZYK-1 B003NSPOF2-0 B000SSDTOI-0 B0009OAIE0-0 B001T88N0G-0
9272	A3JIC0P4UFN8BA	1368921600	B005I2MP62 B001F0R25A B000TKH6G2 B000ZLVUYO B002X9XV48	B002HEW7Z8-1 B00AWR9CUU-0 B008NX5AGK-0 B003UZ4R24-0 B0009MHJS0-0
7539	A324GIXX5SIYGA	1368921600	B00027DMI8 B002SKTTVQ B0018SAJAY B005A2M7WC B001AO0WCG B000F63TW0 B004GH99QO B002CML1XE B003654SVS B000P279E8 B001D0CWQG B0046797WK B003I6O5RC B005F5J5Z6 B005EII2OY B004675EI6 B000NWDSAE B004BCXAM8 B004BCVD4A B0010XUU9M B001GMANIK B0009HJBPE B000GHVCM2 B001ET7BQC B008C130XS B000RTPT8M B00787QT6W B0030HKJ8I B001ADSI3C B001KYPZRS B005C48WB8 B006WVCF18 B0030HAE2Y B001Q8560Y B003PL9PLG B0000531NU B001PUR1GK B00387F42G B006UET5UG B006UETDGC B0047F70B6 B00027D0DU B00387F426 B005I2MP62 B006UET4XE B006GQTZ8A B002SVIKLK B006OZF7C6 B006GQSBZS B006GQEI0A B006GQSH0C	B00112DUFS-1 B004DIXYUI-0 B004VM9JCS-0 B008CEDX8M-0 B004D2826K-0
93	A10S8JTRCL7BR	1368921600	B00007M0CP B004TSCQ9M B004DM595C B00AFBSIPI B0064EJ44O	B001MA0QY2-1 B003FXE6VI-0 B004O3UIT2-0 B003KIU14O-0 B00B3MGWTM-0
1652	A1GWJM5Z1ELOK8	1368921600	B000F8HWXU B003SSTL42 B000LPJASC B000PLUZL8	B009YCEMU4-1 B0007CXXDC-0 B002Q6UAH4-0 B007AS626G-0 B002LHG9HI-0
7429	A311YKH6RB7AWY	1368921600	B0009F3NGE B007ROD2P2 B0042PEBMM B002B4EFCC	B001ET6XKM-1 B001FS0HAY-0 B001GGX0EK-0 B0033PSM6S-0 B0002JKQ8K-0
8981	A3GPAR4H5Y5OU8	1368921600	B006RGM5YK B003V3ISS4 B003PLJP2A B00013TQRE B002DPUY8I B003PON1M2 B002BW3LT2 B000YG82HI B002BWOXWG B002PBLH3Q B000KFX10G B001PN55KQ B004D248U4 B003WN1ELQ B003LBWQQQ B001KUTR9E B0011UVCKU B000F0QCWA B0030O3VRW	B001S48HLG-1 B003J4TJTM-0 B0009RF9OG-0 B001E765KC-0 B001E765KC-0
10910	A7IAI7D0HKLLU	1368921600	B0007DHMBK B004S3M2V0 B000FQUGXA B000RLXG6W B000VV1ZMU	B0091391DE-1 B007E2K41W-0 B001TSJ7ZQ-0 B0010XIO86-0 B003VSDR7Q-0
5732	A2KRVVE2O9FOKR	1368835200	B00080DK86 B000H9C1UG B001LIO0ZG B00014FTTM B001ECQ3YU B000MXHG7A	B002WR58XS-1 B00DQUVXPW-0 B004KRYVZ4-0 B006MRM2TW-0 B00004TMFE-0
1	A0078719IR14X3NNUG0F	1368835200	B006L1DNWY B005Y6F4WO B008SPOKIW B0083QNBCM B001CE6T76	B0098T3D5I-1 B001FWXHC0-0 B0000YV6YK-0 B000Q97ZS0-0 B004LSLE0C-0
9215	A3IZ0L4MIEC7RD	1368835200	B007AS4L96 B004FM6M2O B001EM1BBK B003TNY0WE B005GYL9C8 B003UA5HCS	B0084SSLVK-1 B003B9DWMA-0 B005HIH738-0 B000C1VX5S-0 B004C6ZC5G-0
8756	A3EK1NEPCXMGSY	1368835200	B0049S5DFG B003901LEW B000052ZB4 B006JKX5RK B00006IV30 B000TKH6G2 B00535OW6A	B000052YOR-1 B00005321Z-0 B000LJCNG4-0 B000HGMU0K-0 B002RJOR7Y-0
9685	A3NNB7ZUWPBDJJ	1368835200	B000GDC4J6 B000GDF48Y B000GDA04W B00B7MUJR4 B0006G2EX4	B003BR38YO-1 B004P2RZUC-0 B00385WMJ6-0 B002CEV1W8-0 B001LFI75I-0
9117	A3I03URMVLXRDC	1368835200	B0009QZXQ6 B000V5BXNM B003BMG8K0 B002XHACJW B001A4826E B000PLUZL8 B004ZC13OG	B004BC9T9G-1 B007OT1OPU-0 B004NYTR8U-0 B00AYARK2C-0 B0015A807Y-0
1373	A1E1TX2SS7D6T0	1368835200	B003BKYYVW B004LRO7DO B004JZNKH2 B00535OW6A B003CGTKUK B006ZENPYS	B001AD0HL8-1 B000VRTE9A-0 B004KS2MZY-0 B002K4NVAU-0 B001E0VBDK-0
11475	ACWD9XZ6I6NB8	1368748800	B0039VOSPU B0020MMCZW B000WM2V9O B000IEL5FC B005JJ4GX4 B004LCZEJK B000P20U6M	B000C1Z8MW-1 B003XUMQ7E-0 B006L1DNWY-0 B002XXAUE8-0 B0016BLWEU-0
879	A18U741AFDT54Y	1368748800	B005HJTTM4 B007M0STLI B000PQGYOU B002MZ8BK2 B0078VJ1OK B0058L24O6 B007N0FYX8 B005FJQQMC B0040BK082 B0017BGQR2 B008UAIM52 B0078VTGOK	B00787QT6W-1 B00355J9K4-0 B002KAGWYQ-0 B0014WKHT2-0 B004YRTZG0-0
9639	A3N72YOPCU7JLP	1368748800	B006L1DNWY B008U1Q4DI B005EHHWPA B008A3WGTM	B005BTCPRG-1 B002QI1E9K-0 B008Q0E714-0 B0046VGIRI-0 B00164RON0-0
6428	A2R7P4A4CT2Y7R	1368748800	B002DOO1VA B001C6H6F8 B007TLJP2W B003CTU5MO B003VI0HVA B002O0D8P8 B0054Y0PMK B004DK5CCY B0058CJV50 B003EO466S B005FYJB92 B008D4DFE8	B000EGOG46-1 B00DD96JVY-0 B001PRJ9XQ-0 B004LJ0ZK6-0 B000IOFQWK-0
3275	A1WSZED2O5MA5T	1368748800	B004W17O7A B0002RI2PG B007LANY2S B002PBLH3Q B001OVQSJG B003I5SC72 B0002Z0U5I B000WXZE1K B002FJ11UW	B001CJFEYK-1 B0012XO2W6-0 B002CEV1W8-0 B004NYSL9Q-0 B00028PXAC-0
25	A103EB0NUZIX2S	1368748800	B0015AABEE B0072CV36Y B000LPJASC B000VRTE9A	B009JJA49U-1 B002AMUICG-0 B004MB8KNC-0 B004I5DFYQ-0 B003VMM74Q-0
11340	ABOTQDXWRU51G	1368748800	B000142C1A B002KMXO36 B0018BTA2Y B00699IIW8	B002GP5XD6-1 B004AJ1MN6-0 B00A6OTXOO-0 B0014UAHQW-0 B000SSDTOI-0
8024	A372AQ2DI105YK	1368748800	B0009EXM52 B000OFB5QO B001DKF08S B002P9FGWQ	B005O54SVS-1 B002IY2EBY-0 B001LF4G6W-0 B004D247SC-0 B002X9XV48-0
11901	AH32BK6OVLY93	1368748800	B000V2J3ZK B0010A9RYO B0018S8MZ8 B00127C83M B000V1BDIG B000FBNV1Y B005HIH7YM	B008DWSJ1O-1 B000SIGZB2-0 B00390DN34-0 B000SIGZB2-0 B002T5IN5I-0
3190	A1W3BKLHPAWIOO	1368748800	B002L6M068 B00ATWDTIE B001KYVOJQ B004LXHEX8	B002B4JP90-1 B008U2Y9BQ-0 B000050B6U-0 B002KAGWYQ-0 B001LF4G4E-0
8409	A3AVBHWUW9DVMU	1368748800	B002ON11RW B001G7OCSM B0046VESSE B003E23I96 B000GX77NO	B0030O3VRW-1 B002R23I76-0 B001ABLKK2-0 B001EDHAU0-0 B00BHRC7R4-0
8784	A3ET198ETSLPG3	1368662400	B0009JQFF6 B0027CT5SC B0006DS3KU B000G33KEO B003KIU14O B000142FVW B006BA3BAY	B005X2F7JY-1 B008VDLAIE-0 B002RS6JQW-0 B003RF82RI-0 B002NV8Y3E-0
11151	A9UNQTJOLE5TF	1368662400	B002WEBTPW B0048KSGZO B007FWBZF0 B00340UTWC B00373FE76	B004FQGLQC-1 B000XYPNMS-0 B001ET78RE-0 B000C1W032-0 B006I33WQM-0
12716	APASW0USALPXM	1368662400	B000WZL1ZQ B001UREIFU B002WTC384 B003BL7M7E B002WTC37A B0009MHJE4 B000J41MNG	B000POX044-1 B005OZJYUS-0 B0065UOF28-0 B000RO3EMA-0 B003XUROEY-0
6084	A2NOKKUPWHNEPP	1368662400	B00074XC68 B003ICXD4M B001DKRM8O B003FBI9KY	B000H0XV3G-1 B006SQKIHU-0 B002RXW5BA-0 B006YC3UP0-0 B006YC3UP0-0
2697	A1R6GSEASGXJGA	1368662400	B004NMR6TY B0032Z21HK B000RB40VC B000C1VY9I B002BWOXYE B00092M36I B003UNT4P6 B000C1Z1HE B000EPA4GQ B007QOKGPW	B002HPBF32-1 B000052YP6-0 B0020JESMU-0 B00181WCN8-0 B004GYQLFE-0
1349	A1DS3TNXYG7BD3	1368662400	B0009XH6SC B000GCIBY4 B00BTFKGNG B000142FVW B001LFIKOG B005Y6F4WO B0017ZDH52	B008STA7IK-1 B000ZMEW66-0 B006UET4XE-0 B007RIC79K-0 B000G33KEO-0
3626	A200H4IATYOQ73	1368662400	B007WL2UL2 B009LY2GC6 B002OU7V42 B00AKYYSCM	B008RTNSJQ-1 B005R3IPJI-0 B002RJOR7Y-0 B002RJOR7Y-0 B0002SA9BU-0
3695	A20OXNBPMLRUHC	1368662400	B0036LJ0HO B003KIU14O B003COAFPQ B000GCQ04C	B0092SVTGA-1 B0018S6MO6-0 B002S8RWYY-0 B003UH0528-0 B000C1VT3Y-0
1415	A1EI7VZV0HYC3D	1368662400	B0036LJ0HO B0009OAHNM B004DIXYUI B004Y9GVZG B000RGZK02	B008U5JB3Y-1 B009VGNYFM-0 B005OZD9QS-0 B0049CERRC-0 B001BHUFTW-0
160	A11KIUCGOCN4AO	1368662400	B00387F42G B002QI1EKE B0067H6G2G B002RL8IYA B0084SSLVK B001390QH4	B001EDHAU0-1 B000I20Q72-0 B000I20Q72-0 B008JWW5K4-0 B001189I3A-0
11154	A9WF2OPZZKBI4	1368662400	B000GIL1UE B00021DJ32 B000P2301E B0091JL3IO B001XVYBGO	B008LF5U7E-1 B0057JCYYE-0 B000R92XIG-0 B007RIC79K-0 B001D0IWDS-0
1816	A1IGTR6B4O6EQW	1368662400	B002DOO1VA B004SU8EKG B008R56PVI B002QASVFS	B008JWW7MK-1 B0015358TE-0 B000052ZTY-0 B0012UEJ1S-0 B004Y5M8QQ-0
5255	A2FVD05Z2FYW1P	1368662400	B001J2ZXMI B0027CT5TG B004Y4JNZ6 B005KJ35D0	B005KJ353U-1 B00DLRNSSK-0 B001QYBURQ-0 B001EDHAU0-0 B004KRYVZ4-0
13614	AY8GWRA0LQTAB	1368576000	B001CYRV64 B005RF98HE B0017SWIU4 B005XP4YNQ	B0012UK304-1 B000EVKXKM-0 B001AO0WCG-0 B002D48QIE-0 B006VYG9YU-0
605	A168M9ZH3K3YG	1368576000	B000PLUZL8 B000Z61PEY B000IMPD3O B00120IJSC B000FBNYRU	B001D0CWQG-1 B0079M7VN6-0 B005OZM810-0 B000LGNQPY-0 B000LGNQPY-0
925	A19CZ4AFTM2KKG	1368576000	B007AU0FXA B003ZUTWVU B003VMU63K B000REKQDK	B003VMTZ8C-1 B004ZH5MTS-0 B0022077CK-0 B001SZ1NUW-0 B001H54SQ4-0
12987	AS2RUO7ZCBDIW	1368576000	B004GK2BUM B000SX3380 B000XTCFME B000IOFQWK	B001ADOV4W-1 B001OMI9VA-0 B001OMI9VA-0 B004Z209HS-0 B000JVA80C-0
13192	ATZ76T8T44SOH	1368576000	B0062JUMUG B004S9SEWK B004LWXTQA B002YR2D5W B004WC2H8A B006YUOHXQ	B000UPRSKA-1 B0017KCPUK-0 B009LYB2E4-0 B001DJDP7C-0 B0001MROQA-0
13655	AYOHY9SL13PR6	1368576000	B0027UUDFS B006HTNOHY B007OX0RBS B005Z41P28	B005Z49PQG-1 B005C2NBC0-0 B000VV1ZMU-0 B0002EBI82-0 B0089VD8WO-0
2746	A1RM8D4R7NR4E9	1368576000	B000N7BARW B001IMSIYY B003J5C01A B0002YE8IO B0055ERUC2	B004ZMTK1Y-1 B0094C4XOO-0 B007TQBGCY-0 B003BJZ1M4-0 B002GOXELA-0
7379	A30KDVCH47VFFL	1368576000	B002PBCAEQ B001KYRWP6 B007DGRT3K B000KFVY46 B000ILKUT2	B000LQ30AA-1 B000AA9HQ8-0 B00365DABC-0 B00021DVCQ-0 B002ZTT9II-0
6877	A2VOMWM3O95P7O	1368576000	B003STPN4S B000NW4I7G B0009DVMAU B004NYSL9Q B005BTCPRG B004DC2PM2 B000L596FE B001LFIKOG B002MZ8BK2 B0053SYDI4 B005F5HHL0 B004UOD4CS B002QA31SU B005C5FP9Y	B00A1Y177A-1 B00DHOET6W-0 B004JZT328-0 B0055Q6MYM-0 B002UL35I6-0
4741	A2AW50VXHR18UL	1368489600	B008HZ5GUY B004K3D0FK B000XVDNCI B00027D0DU B006Z8BN02 B006Z8B5HS	B006UET92K-1 B007UUE824-0 B000MUV9NU-0 B000GDDKIU-0 B001RS8NQW-0
5869	A2LTKAPWNUNUFZ	1368489600	B000F63TW0 B003GYVTI4 B003FBI9LS B003HYMGJO B0060A2QXI B000WYZ9Q4 B004ROW0QM B007P296VA B004C4BUGI	B000ZMBSPE-1 B00535OW6A-0 B001T0HHDS-0 B003QU26ZI-0 B00613KK96-0
4847	A2BUUYQ2DDAKUE	1368489600	B00766SGPM B000WYZ9Q4 B0052D4416 B002MZ8BK2 B0082D9SUK B009YVCSYM	B004Y9L926-1 B001QT3GVO-0 B003TU4CB6-0 B001G3VA22-0 B001G3VA22-0
7152	A2YDCADNX4XKG	1368489600	B001P4FJ0G B005R3IPJI B001MWV40U B002DPUY5Q	B0009MHJE4-1 B001MX89Y8-0 B000RGBWPO-0 B001189I3A-0 B00AQ9RTBS-0
10409	A3UF38YLQMEQ0A	1368489600	B009D7V4WO B003OGSX4M B001RMP7M6 B003OGYO7W B005MG86TY	B004VFXVJW-1 B00B0QJC6Q-0 B007UUE824-0 B004GWUPO4-0 B001MX89Y8-0
1657	A1GXG9H0AS00AK	1368489600	B003B3OJ7S B0047WWDNO B005GVY48M B006R1LBJA	B005AKBUEA-1 B00AM7BSXO-0 B0091IJ4C2-0 B009WS6MUS-0 B0002JGU30-0
6260	A2PCJ19IEGIDAP	1368489600	B0007DHMCO B0031EM85C B003DGWTXE B00117CH5M B000ZMBSPE	B000P22UUG-1 B0006M5566-0 B003Z4UKGM-0 B000BH92J2-0 B008XWYBF2-0
7311	A2ZWRH7OHC672J	1368489600	B000FZVSNI B0012RYDR6 B007OT1QMQ B0002YE8WA	B000BIZSYO-1 B006Z8BN02-0 B002F4Z18A-0 B008R1JSKW-0 B007NXZ0T8-0
2864	A1SS7YDH3J2VC	1368489600	B006OMHR1S B0082XRJXS B009NCM6JY B005FK3M46 B00B868SK4 B00B83LNWC B00B83TVS0 B00B83SVFY B00B83V0HK B00B83H62I B00B83G0OS	B00B83I86G-1 B0002JIHT0-0 B00C0HF1J6-0 B00AIQOKDY-0 B004WAGFQC-0
114	A111PH76SCPYCK	1368489600	B009M1K396 B0073KABJ0 B008MJ1V3G B0060GFV3Y	B00BCBSJG8-1 B0000530ED-0 B000GX4BSS-0 B0002Z8MLC-0 B005TI7Q3M-0
6693	A2TTHN1UMO82VY	1368489600	B001E6G6FC B001E6G6RU B0028K3J6W B00387F41M B0073P01RC B005ZAYQYG B008U2Y9BQ	B005KJ35D0-1 B004SSFE8S-0 B00APV7OWG-0 B003SSTL42-0 B003QA8XFK-0
8231	A39592617HTTA4	1368489600	B006L1DNWY B0030O3VRW B007Y2IM70 B009T8BF94 B0086LC0WG	B004FAJFDO-1 B00A7FS2OO-0 B002S8RWYY-0 B004VCH51A-0 B00A7FS2OO-0
6395	A2QRUJQ4V9VD9C	1368403200	B002MZ8BK2 B0032K5YSI B0016A8DT8 B006L1DNWY B008AMKZUU B008A3WGTM B00178TVXG	B00B868SK4-1 B00A41G09A-0 B00363HVZK-0 B008X20V6A-0 B00A41G09A-0
9622	A3N3CLV6EBSY53	1368403200	B003I6O5RC B0014R2YRA B003V57Q5I B0008IV7BU B000H88QOM B0032H2FWO B000VPPUEA B005XIDZHO B000TKH6G2 B00683MOWK B0000632EN B001GGX0EK	B004Z209HS-1 B002WWBPNA-0 B001DHNBYQ-0 B00AY49DR8-0 B000R92XIG-0
4499	A28HEO62IGXHRT	1368403200	B003MUYUU6 B000J10IJ8 B003YBP0N4 B002XY1NHU B000YC718S	B001CJFEYK-1 B003VMV7D8-0 B00CDYKRU4-0 B0002EZXUG-0 B00APV7OWG-0
11658	AEMDZJ2RIYNGH	1368403200	B003KPIIKQ B003RF82UK B001AWG0BK B004ROOT8Y B005D0WXPC	B0081E6X3U-1 B003GC4GHM-0 B000NPWQU4-0 B001GIOV82-0 B00AYLYETS-0
13494	AX26SM7H1RNXC	1368403200	B00187Y4M4 B000T217KG B0038U4U3M B000TDBJHQ	B0036I8BPE-1 B0096Q8AXS-0 B005BEF5EQ-0 B0016BLWEU-0 B005BEF5EQ-0
6090	A2NPXTU9EH6GKR	1368403200	B001F51TR2 B0000536P4 B001MWV40U B0036QTJDO	B002D4CXII-1 B007ISRNJS-0 B0091391DE-0 B004Z5H0XG-0 B007ISRNJS-0
10850	A6XNNQSFEJCP7	1368403200	B0046VGPHQ B005E0NDEG B002N5MKM6 B000MVVK7E B0042GH78G	B001MX89Y8-1 B004VMGTY4-0 B004VMGTY4-0 B004D267RG-0 B00BV5EW8Y-0
951	A19RD443T9F1WX	1368403200	B003901LEW B004813W5M B00085DX0Q B000052YJC B0013OFRUK	B001H54SQ4-1 B004Z209HS-0 B003UA5ECQ-0 B001G0JNP6-0 B002KPWZPG-0
5794	A2L94GUUK8SQZQ	1368403200	B00390DN34 B005E0NDEG B0092SVTGA B0038O0YEC	B00A6OR7N8-1 B00D0ANSAG-0 B000RYSXWG-0 B004DIXYUI-0 B001BAROMK-0
11259	AAYOXIQOND9QE	1368403200	B004E79EQQ B002EQQ11K B0022H6JQI B004BCTBAS B004GH99QO B002WTC38E	B004I6O3LO-1 B005UKRRKG-0 B000C230QM-0 B003ZS6OJK-0 B002IY2EBY-0
13269	AUQIJPXMKNTLQ	1368403200	B00005A9WP B003COAFPQ B000I4AMDS B00187EX6G B000OV3ZDO	B002PBAJ4Y-1 B00871KLRQ-0 B009MY1P3Q-0 B003TPA9XG-0 B001B1831U-0
9335	A3K74114J852FQ	1368403200	B004KS2OHA B0032K5LI6 B0085QU1GY B008Q0E714 B00ANTDQL8	B00AZ0FJB0-1 B000NE6PCA-0 B000C237HO-0 B004MTCKSU-0 B001T8OEBI-0
10296	A3TGNEA6A2VIEP	1368316800	B002WTC37U B002PBLH3Q B006YC3UP0 B004Y9JURC B0042L07YM B00BTFKGNG B000H3EMMM	B001GGX0EK-1 B001ADOV4W-0 B003CE8BAW-0 B00027DMSI-0 B001U23VB2-0
5296	A2G8W6K7UW1KLL	1368316800	B00A51LI1O B001ILMGDO B00429BV3K B0084BPHRI B0086LC3KK	B005NZ109W-1 B000143K2A-0 B001LFI75I-0 B002M7FHFM-0 B004IZJ2QG-0
12601	AO7FHLEDLVQAM	1368316800	B002C7487U B0013GB1Y4 B003HO30Q2 B000NSTX20	B007P7Q4Y2-1 B004BCT7G6-0 B003KPIIKQ-0 B0054GBXOW-0 B004NYZ5AE-0
4797	A2BEFIJOBPFVPA	1368316800	B002MZ8BK2 B0080GV0Z0 B0013JHGPO B005XIDZHO	B00631JA8S-1 B00DQ2IMRW-0 B004O3UG4Y-0 B004L96NZW-0 B003M6AS4C-0
2628	A1QL898DOQT0JB	1368316800	B0039BGHW2 B00277JKY6 B00005CDSP B004DK7DVC B0007DHMCO B002QI1E9K B000YDF6CA B001JKTTVQ B000NSQI4Q B000YP66WC B002L6M068 B001KYO7AY	B0030HKJ8I-1 B0047ELRO8-0 B0012UEJ1S-0 B001QX7NTQ-0 B007KJ04EG-0
11078	A94IFOBEK4NJ7	1368316800	B001DKVBJU B0092SVTGA B000I4YTDW B0030HKJ8I B005FYJB92 B004O752PI	B0068Y6CA4-1 B001RS8NQW-0 B0084SSLVK-0 B004AIU8H8-0 B000Z43P80-0
8811	A3F2TL0UCFT0MK	1368316800	B000E8O8UQ B00479DRFA B004DK5CCY B000F0QCWA	B0002EZXUG-1 B00028OTAM-0 B001DXQMS2-0 B004NYZ5AE-0 B001DXQMS2-0
1949	A1JNZHOZCBZ5JI	1368230400	B001A3ML3K B002G5ULWY B000VTVD6A B000JG1QDA B000XYPNMS B004QRX6U4 B0002JHI1I B001641KGM B003VI0HVA B000HJT1CW	B004Q1GCFG-1 B001KYVL2G-0 B00528M5IU-0 B0034BUQ42-0 B000Q8PV96-0
3739	A215ZZFPVG5CX5	1368230400	B007FIUES8 B007FIUFN2 B0047WWDNO B00390RRX6	B002QB52W2-1 B003VMOGSQ-0 B004TH6Q9Y-0 B004WPWOS0-0 B008HODSNW-0
9401	A3KWC9JLXC4TB6	1368230400	B003EGWQ36 B00838FLXW B0001LH6YG B0061RAHG8	B0019IC2N0-1 B005X03V1W-0 B002D48QWA-0 B000NSIGE6-0 B001DKRMB6-0
12625	AOFMA2QQUTN2	1368230400	B00429DO0I B002MZ8BK2 B002LFLXDA B004DK0UDA B0094DH1RE B004Z40048 B000NSQ63E	B003Y5XIT8-1 B000VRTE9A-0 B00B0JW968-0 B000VRTE9A-0 B000HJ4INE-0
11793	AFYEZXUEDSSWX	1368230400	B000VL292A B005XIDZHO B0001ZA3Y2 B00ARBCWYY B000XJ92E8 B000ZMBSPE	B000KNHJ5G-1 B002VRPXNO-0 B006EOCS1U-0 B000VUKQ8K-0 B00011JOR8-0
11313	ABGWSO2WPSSHF	1368230400	B004B0U57S B0083QNBCM B008U1Q4DI B0086LC0H6	B005ME8WK4-1 B001EWET96-0 B002LFLPEC-0 B004QLOFTG-0 B004Y0HC80-0
576	A15WO1OAWBWT9Z	1368230400	B002B9DWBC B002C1JEPM B005Z6K2T8 B0027A7CMK	B0027A7CLG-1 B004NZ3D66-0 B003FXE6VI-0 B008JWW5K4-0 B0071OF8CI-0
5718	A2KMTDXF78JTKR	1368144000	B001P4FJ0G B0013N896U B003V7KWB6 B000REKQDK B002KJSD8K	B009LOJ5MA-1 B008R1JSKW-0 B0032K5YSI-0 B000S8JB68-0 B001V9OO60-0
10921	A7MJN6MN50598	1368144000	B000052YOR B001ECQ3YU B002ZASTP6 B00028O7ZO B004DIXYUI	B0000UTUW4-1 B0028QXB6E-0 B0015A807Y-0 B004BCXAM8-0 B0017KGOY8-0
4385	A27ATS7F8V7CPX	1368144000	B0069SC0OQ B0089VD8WO B0017BGQR2 B002OU7V42 B006ZAPMT8	B000HHOPDE-1 B005TT8T4G-0 B009SCRSHE-0 B0016JFH3O-0 B0030HMQTS-0
8506	A3BUG7BM52PNH5	1368144000	B0055ERUC2 B000KOOCQO B007ML0OY2 B001K6EMQG B00447EWNG B00027D8IC B001FYZTEW B0041QVYS6	B008PGD4UO-1 B001C53IBU-0 B007L5UGZ6-0 B0013GFECE-0 B005LK6F58-0
5692	A2KFKS2SL7CMS3	1368144000	B001MP2P64 B0058E3XJI B006ZAPMT8 B00150LT40	B000Z43P80-1 B00BLA2ETS-0 B0006B12KK-0 B0009STDD8-0 B001ET78RE-0
11688	AEYTARKHJBH94	1368057600	B004X1QY20 B003S17772 B007M6CTW2 B005XP4YNQ B0034KYDRE	B0018V1DWE-1 B0018S6MO6-0 B005SPETH2-0 B0009MHJS0-0 B004IQIVL2-0
5041	A2DPY1L4RDVHCV	1368057600	B000ZOHOQO B000S205WS B000HJUWRU B000ELP5KA	B0037TM252-1 B002QA52V4-0 B00ANTYSY2-0 B00DH0TRYA-0 B0011292ZK-0
86	A10OTOBL3K2BHE	1368057600	B003UH0528 B005P11F4O B005OZN56M B005P02U8A	B000PHRIQM-1 B008A3WGTM-0 B002787ACO-0 B009CA7T4O-0 B005V1J9PK-0
7266	A2ZCGTKB239QYJ	1368057600	B002S8TOYU B005EII104 B001CM1XX8 B004BCXAM8 B000G8LWZI B004QLOFS2	B007JXLT9M-1 B000GCVZSI-0 B006QV2XDY-0 B0009EXMB6-0 B001KYNZGG-0
10103	A3RK4BDGUO5370	1368057600	B000X9WXSU B0014UAHQW B0051918JW B0006GBEYE B0027UUDFS	B003IU9HI0-1 B003YCAQDC-0 B004OEO0E0-0 B004BCVG1U-0 B0018OWHQM-0
888	A18YQ1GK642VS4	1368057600	B002WTC38O B003ILUQPM B005VX8S4G B002MZ8BK2 B009NCM6JY	B00CDGR29G-1 B003IX36H0-0 B00CQ5C54G-0 B0030HAE2Y-0 B003ZZQ2JA-0
12576	ANZUL0D4RP4HE	1368057600	B000RGZK02 B001MW1MKM B00005NFBD B005TI2A74 B000F8HWXU B007DGRT3K B001FWXMGG B002QI1E9K	B000XPC8MA-1 B000FQNOQG-0 B00127C83M-0 B0007CXXDC-0 B004UA2RYI-0
13722	AZC112AVRFJEQ	1368057600	B004WSXD4G B00B99O5WK B002LHG9HI B004UOD4CS B001UREIFU B0054MS97A	B000EGK528-1 B001FYV0HM-0 B001PNFFLK-0 B002LB75AO-0 B00631JA8S-0
4753	A2AZHTHKX9XYJQ	1368057600	B000RY5YY6 B000FPVMCU B003UH0528 B007822G8W B006QREEZS B000LEHMUQ	B0012QD7EC-1 B00195MZUI-0 B003M57E9A-0 B004L96NZM-0 B001EO5X12-0
5994	A2MYCLMG0D3YR7	1368057600	B004K0CRIY B003VMVBVG B0057JCYYE B0018C0HLQ B00198ZOU8 B000QE5GU4 B005WTKB2Q B000C230QC B004LEJ8R2 B000U0XGME	B003OGYO7W-1 B000H3CPNU-0 B002NBF8SI-0 B00027CDYM-0 B005K0DO8A-0
8954	A3GFS8ZNAXWVGO	1367971200	B0082XRJ5Q B008SDY08O B006OMHUZQ B00BTFKGNG	B008Q0E714-1 B0051AZAMW-0 B0036B3C0A-0 B007CDSFKU-0 B0086XX0AK-0
4187	A258JBQJGYOZLX	1367971200	B002LB75AO B006BW34TA B00021DDR4 B000BP81IM B00AUFSOU8	B008NX5AGK-1 B003FBKAL0-0 B005TT8RPM-0 B006ON74II-0 B003FBKAL0-0
4885	A2C6VPZHZ4QN2A	1367971200	B000TNOUA4 B000VBDWQC B003I6O5RC B0046VGIRI	B004BCVCYG-1 B002MJG5T2-0 B000H3NF5W-0 B002LE54P4-0 B00BETYXV8-0
2449	A1OQK5ZAHSGDAR	1367971200	B002F5WLOQ B002NCTEZA B000XT89S8 B002787ACO B002NV8Y3E	B00028OTAM-1 B001CJMLHS-0 B001H270RQ-0 B002PA2LNC-0 B003GMS8NK-0
2754	A1ROCF0W1X8I9I	1367971200	B004KELK4C B005D0WXPC B004QBRX5Y B0039BGHX6 B004HIBLNQ B004ICVLWW B004L96O10 B001B9RGVU B0077S35WS B00016XJ4M	B006POOQ1E-1 B001D0CWQG-0 B001D0CWQG-0 B0002JKQ8K-0 B00A9MKPT0-0
10638	A4NO5268WKDT6	1367971200	B001RMP7M6 B003VMZYSC B003VN1ING B003VGMLSO B004NMTMUK B004SS6IKG B003VMF5S6	B004NMYM96-1 B001QFDTWO-0 B0048O2R1E-0 B00AP1BTZE-0 B005I2MP62-0
8753	A3EIDGJ92SXMQK	1367971200	B0053ZA1ME B003VMZYSC B002MZ8BK2 B003ILUQPM	B005BF1M10-1 B000052YM8-0 B001MIZMN4-0 B0007D2F3K-0 B00178TVXG-0
13052	ASMH0B2JNERTO	1367971200	B00AS5GHKO B0068Y6CA4 B004DK0UDA B008Q0E714 B00A3C06XG B005E56EJC B004NYWR7S	B004NYZ5AE-1 B000C1Z6VA-0 B000OY3WNO-0 B0056FL4FY-0 B000FS05VG-0
9447	A3LEGZWFK44DJ8	1367971200	B005GQ6EIK B0026J10CU B002DOO1VA B00644YNCM	B005X2F7JY-1 B004KU9PN4-0 B00A51LI1O-0 B004KU9PN4-0 B001MA5VUQ-0
3954	A22XPP2BS8DRXJ	1367971200	B005FK3M46 B009NCM6JY B008Q0E714 B00ANFYEQS	B009YJESAG-1 B009ZRFJFA-0 B0015358TE-0 B000GX77NO-0 B0034XRY7W-0
4925	A2CK1VAJ85IS63	1367884800	B000HJ0ICY B000HIYE0M B004CSU8IA B002CMLHF6 B002T71I3U B000PKZG22	B0092MCO88-1 B004NMTMUK-0 B00BRUS5T0-0 B000KONYJK-0 B000N2IGWY-0
4813	A2BJEXP8HYQATV	1367884800	B0084SSLVK B007M81AAC B004YWS430 B005XP4YNQ B001JQLNPA	B0002RI2PG-1 B0081CWUD4-0 B001UHN0FE-0 B008HBMVZ6-0 B0081CWUD4-0
10763	A601IGAG8FWGW	1367884800	B003156NFW B004W55086 B0094C43FI B002GP5XD6	B005KJ35D0-1 B00356UHT0-0 B000P4ZOIE-0 B000E793P2-0 B001M9YQBW-0
10708	A5CDMTW6JKV5G	1367884800	B000GUZ8HY B0000632EE B000B82TD2 B000KONYJK B006RFZ8NG	B008U2Y9BQ-1 B00COVNG7W-0 B005JZ6PNW-0 B0047PPCAW-0 B002HK2GOO-0
6220	A2OYOVE5A5TJ9K	1367884800	B005KSBVHI B00433VGVW B003GDKMVK B000052YJM B0068J5K52 B001B1831U B001MX89Y8 B004DIXYWG B0030HMQTS B006OY1MO4 B004Z67NSM B00005NFBD B0009H04LO B001IACZEK B000NWDSAE B000K9NZJE B006OHM542	B0000530O9-1 B0061YRVNS-0 B000EA2M3E-0 B00CM7YTO2-0 B004LSLE0C-0
1335	A1DN2GHO5B7CLW	1367884800	B003VMM74Q B00649P3H6 B006EOCS1U B008MCH5J2 B009IROLBU B0063TFLG0 B008BCNL3C B0017BI7NS	B003VMZYSC-1 B001U02HNC-0 B0028BKV4E-0 B006R1LBJA-0 B00143S6YO-0
13343	AVHJITZBUKS4S	1367884800	B001BMLJU6 B001MW1MKM B002IFT5VA B000C1Z3LS B00021AK4I	B001MA0QY2-1 B0034KYDRE-0 B0015XNAS0-0 B004V6BIZU-0 B002PBHQP4-0
12783	APYXXI66QOWYJ	1367884800	B007ML0OY2 B001MIZBNA B004TSFE28 B007O7AZBG B00433VGVW B005UL3LVY B001KYNZGG B004TSF8R4	B000F8HWXU-1 B00021AK4I-0 B00641UCY8-0 B000LJBYAU-0 B004GV8H7C-0
2648	A1QRZK8OY1GRFK	1367884800	B0012RUL40 B0009OAI40 B0001XLSR0 B004ZLZ77G	B005J5TIYK-1 B001CPM03C-0 B006J5YANS-0 B0048CAUTC-0 B0048CAUTC-0
7163	A2YFVFXAM8WV9T	1367884800	B0020MMD0G B000GHWSG6 B002Z7FVTQ B0041FDD2C B001R22918 B000ALFROS B000674Z8A B006YC3UP0 B000H3EO34 B000VOHR88 B0013N73QM B006AU1XAA B003JNQV7G B004HA6F2G B000C1Z6GU B003FBI9LS	B0009RFB76-1 B007BSA5ZO-0 B000Q97ZS0-0 B007BSA5ZO-0 B005K0DO8A-0
11501	AD52829UHABMM	1367798400	B0011DS3CW B007JBF99U B00428DLCK B000ASDX3S B000VDUOFM B0043BUW78	B004ZD2M6I-1 B00CBYAP0S-0 B000PI9MO2-0 B0040BK082-0 B001MIZMN4-0
6004	A2N2BYX2SXO2Z	1367798400	B00277JKY6 B003H0U5BY B000SSDTOI B004D2DR0Q B001E96NEI B001P93MLE B008U12YV4	B00005V5OU-1 B001GMN7K6-0 B00AZIZJIA-0 B0012RXW1O-0 B001MIZMN4-0
13688	AYZ4L8A48FSCO	1367798400	B005XY43IS B0016A8DT8 B00631JA8S B00B868SK4 B003GDK6F2	B00A1Y177A-1 B004W3OR14-0 B000C1Z19M-0 B004W3OR14-0 B003IMIWRK-0
13439	AWE2MNHN7KQMN	1367798400	B001129368 B007APTJ0U B001OQH6HY B0047PPO0U	B004LXHEX8-1 B002MJG5T2-0 B007S0CM2Y-0 B000G014Y0-0 B003VGMOR2-0
8611	A3CWQJJQE8UMQH	1367798400	B000FFCXZ0 B002U774PK B000J2652Q B0002JIUDS B001ESOKOY	B002D89VHK-1 B001EJOPV6-0 B00014GTWS-0 B00AIQOKDY-0 B000HJT1FE-0
1748	A1HTDH4UD75OQ2	1367798400	B004VMGT2Q B004W1SJDI B0053L2E1O B001G773BU	B006SQKIHU-1 B00631UQH2-0 B000P3X8HY-0 B0017P7BOA-0 B000R99V5O-0
6712	A2U1R1RMZ0AV2K	1367798400	B003E1B6UU B002OVV7F0 B006UETAB0 B003UNPS0Q	B000PHRIQM-1 B000O5RVJO-0 B006U98T08-0 B000FVHS4U-0 B002RS6JQW-0
9294	A3JOWTN8J6DLNX	1367798400	B0030O3VRW B0030HMQTS B0027A7CLG B001T8QJSO B0002YFQ6W B004IVM0EG	B006ZBP8NM-1 B006UQUQPM-0 B003B6S36S-0 B001TSJ7ZQ-0 B0026OYLS0-0
5035	A2DNMHBMMK54L7	1367798400	B001UHN0I6 B006EPIJTE B003VMXYLG B0057JCYYE B008MJ1V3G	B004OUFZP2-1 B008DROBOS-0 B00BKONH5U-0 B000Z43P80-0 B007R6AOA6-0
13264	AUOCBKTL44FPV	1367798400	B000L9YYTS B000J4N78O B000ZMBSPE B00016XJ4M	B0018OWHQM-1 B003PL9ONU-0 B002M7FHFM-0 B000H3NF5W-0 B00BEGEQKE-0
9713	A3NWEZTP7AEEDY	1367798400	B007WIHC7C B0034KYDQU B002UKP1NO B008X20VRO	B004VCH51A-1 B000XE1TUI-0 B000H3EO34-0 B002LMNJDA-0 B0016L5AA2-0
8253	A39B5S82EYP4SB	1367798400	B001H54VJI B00006IV2F B0013CSGBE B000ODNSR0	B006W1BSD4-1 B000LRISO2-0 B008KYB8QS-0 B001711FMI-0 B008DF6XB4-0
12962	ARUWGZKK2DNO7	1367712000	B001P5WZE8 B001P60R0Q B00027DDOQ B002X0WLEI B0009R33U8	B0010XIO86-1 B000FLLUDU-0 B002CMLS50-0 B003WXSDV0-0 B003WXSDV0-0
