2589	A1Q5MOM83O5GXW	1377388800	B00012NEYG B0034KYDRE B001DQEGPA B002F5WLOQ	B000P20RPQ-1 B003PFBCTU-0 B0032PQPWW-0 B005N2ZLHW-0 B005N2ZLHW-0
7698	A33NXNZ79H5K51	1377388800	B000674Z8A B001NPF5HY B0006O2IQ4 B008B9PVJC	B003HO30Q2-1 B0015IW3PG-0 B00A1Y177A-0 B0013GB1Y4-0 B001KYO7OA-0
2804	A1S55B77MMNXIT	1377388800	B001D3Q124 B004W55086 B003MTPE5M B003MIQZTC	B005E9SA7C-1 B009ARXD7Q-0 B003SGRJVG-0 B004Y5M8QQ-0 B003SGRJVG-0
8227	A391OOGZ9TPB5	1377302400	B000F4D0LW B004TSFE28 B004JHOJN4 B009KBMWCY B004DGLCFE B00787QT6W B004ITB3IW	B003AKHQG8-1 B0096E8C7E-0 B001F51TR2-0 B005HIH8LE-0 B00110Q8FO-0
10509	A3VHNJ755FGYDP	1377302400	B000142FVW B005A11VFM B000O902LY B003VMZTCI B003VMV7D8 B003ZUZCDC	B004SSFE8S-1 B0068Z7MT8-0 B008CC4I5Q-0 B001CT0954-0 B001G2LWDK-0
707	A179INDOUL5QY3	1377302400	B002GDIKK6 B002RS6JPI B007PQYHJW B004FKD3HI B000C230QM B000VP9BWW B0035LT8WM B00A3BWYU0 B000FBK5HW B007XA49O8	B0000530ED-1 B000NJE3M4-0 B002DOO1VA-0 B001CM1XX8-0 B001G7PMOK-0
4194	A25B8W9VSY0C5Y	1377302400	B000UPXU2A B001EWETAK B0027CT5VO B001CRX0NO B002SFVP2W B00AYOHWQW	B008CT12G2-1 B003TU4CB6-0 B0027Z2720-0 B0038U4U3M-0 B003TU4CB6-0
9223	A3J1BAPPBQ2OAC	1377302400	B0046797WK B009Y2117G B00008J2XQ B008XWYBF2	B00006IV2F-1 B0036IV7MS-0 B00A8M0ARI-0 B000P9B3R0-0 B0036QQWAC-0
418	A14EGTIUFVIIS4	1377302400	B000YBV4GY B003J5C01A B00028OU5Q B0062A47VU B001NFX2QK	B001G2LWDK-1 B0016A8DT8-0 B0019N6RFO-0 B000SDI6MI-0 B0019N6RFO-0
3583	A1ZHJZCNL7O908	1377302400	B000052XW5 B001PNFFLK B000WU38QQ B004X8K0UK B000NBMEVY B000NUW8W0 B005IUGRBI B006K9OQSC	B0056GIKI2-1 B000KONYJK-0 B008RT3FZI-0 B00C0CVAY6-0 B001E96PM8-0
1181	A1BYTWGKRF0LGJ	1377302400	B001ET7M84 B002WTC38O B002LBE796 B0009MHJS0 B000UO9POI	B0031B54EM-1 B0082XRJXS-0 B000052YKS-0 B007UUE824-0 B008532DIG-0
5086	A2E6SGUEUMIOBF	1377302400	B007L7XQT2 B001RS8NQW B000QAVNA0 B000QAVLT8 B007L5P7YQ B000P8559S B0018C1FKI B008MIRO88	B000GDDKJO-1 B000PY9HG4-0 B004LUZ956-0 B004LUZ956-0 B000EM79QM-0
4379	A278S61JJ5Y95L	1377302400	B000J2652Q B003DVNKU0 B001GMANIK B00171ARH2 B001AZS6R8 B007EHWDTS B00BZBFYLS	B00DAGJ3JK-1 B004YVDIAU-0 B0012QD7EC-0 B003WGQAVM-0 B000VDUOFM-0
9032	A3H6P4NL6DUHZW	1377302400	B004Z1L3JC B002B9DWBC B0065DLADM B001129368	B000GDDKL2-1 B004AIAVYS-0 B004AIAVYS-0 B000F3XXZG-0 B000RB40VC-0
6499	A2RWW8CG5J444W	1377302400	B004NFTGA8 B004HYLTTG B006ZBI33Y B0048ICI3C B003I6MLN2 B003PLFHC2	B005O100HI-1 B003VGMOR2-0 B0018SAJAY-0 B002MZ8BK2-0 B002MZ8BK2-0
1796	A1I82T8CMZSQYZ	1377302400	B000R80ZTQ B001QNG3I8 B0047EPOZ6 B001BMLJU6 B00387F426 B000092OX4	B0047ETXD0-1 B001GIOV1Y-0 B00187OEWO-0 B007SIF4BC-0 B0054GBXOW-0
6057	A2NHO4VGF5N5IK	1377302400	B000V2DLJO B0047F70B6 B001BMJPD4 B004BCT8JW B000PNTQW0 B006ZEV036 B002L6PXNA B000NIAAMC	B0030HAEG0-1 B003RBQZKS-0 B001WW8NFY-0 B0019TYZ66-0 B007L8QLU2-0
4256	A25YUPITJYA5RK	1377302400	B008ZIFQGC B000OO7546 B000F0GNT2 B001CL9XHW B000URVDRW B003P85MAM B007S2CJY8 B003VPTA2U	B000052YM7-1 B003CYWTQY-0 B000P275OM-0 B005IMHDW8-0 B000RLXG6W-0
4600	A29G0Y94M1OT2I	1377302400	B000CSDDDG B001ET7J6E B000N36QHA B00005T83D	B007WGJHT0-1 B000GHWSG6-0 B0009OAIE0-0 B006Z43V38-0 B008K2EG50-0
2574	A1PZ608UWKMIS	1377302400	B0069SC0OQ B008FOT6U8 B00871KNMY B00BKUHIO0	B003GMS8NK-1 B006J5YANS-0 B0037LMS0Y-0 B000IOFQWK-0 B000PLS9YS-0
9325	A3K2SWLK8HMX1M	1377302400	B006KXA7EU B0045YVW0E B0009V8N5E B00356UHT0	B000HRVC5I-1 B005K0DO8A-0 B000VBDWQC-0 B003VN1ING-0 B000C1UDPO-0
9082	A3HLUZYBO1S49X	1377302400	B004A7VF58 B004DBU9QW B004CG0XIW B002HJTJAE B003ZYKUYY B000052X9G B0070TSNO4 B00774V4P2 B0030HNS04 B005IUGRBI B000177FXW	B00641UCY8-1 B0063TFLG0-0 B0094KPK70-0 B0027TZPVQ-0 B0036QFZ46-0
11039	A8R1F28PTAYI2	1377302400	B0029OAL86 B005BQ7KBU B007WW1AOE B0067F8BBM	B00027D8IC-1 B00AZBWA5W-0 B0030TZK6M-0 B003PL9ONU-0 B001G7OCSM-0
6394	A2QR8LQDW077K2	1377302400	B004CHF8AY B0067F998G B0061YLQGQ B000P22TIY	B008CEDY5O-1 B00609D92Q-0 B0041P4XTE-0 B000F3ZSVI-0 B001DO1LRS-0
9542	A3M7YXF4H84X5V	1377302400	B000GX4BSS B000GDC4JQ B000O03F4O B000GDDKJO B003PL9ONU	B001LNTNGC-1 B0094KPK70-0 B0033PSM6S-0 B00157RZ14-0 B0027A7CLG-0
2566	A1PURKNC4ESE5X	1377302400	B003V9N1RQ B0009OAI2C B002KP1WIW B004DK0CCE B0020MMD0G B000P22UUG B000C1UC8C B000WZSWZ8 B0020MMCJI B001L2BEWE B000PY17PI	B000C2105U-1 B005HJ4474-0 B0054Y0FAW-0 B0054Y0FAW-0 B004AIU8H8-0
11485	AD0IJBVJ4FPB7	1377216000	B00787QT6W B005FYJB92 B003EBNLIA B0068Z7MT8	B007ML0OY2-1 B00164RON0-0 B0001433VI-0 B008HT1FTG-0 B0006PJSES-0
8909	A3G0WJM976KOGL	1377216000	B000TTPZQ6 B000AAAWEO B000J41MNG B000GHVLUK	B007PQYHJW-1 B000C1VT0W-0 B000OYNCES-0 B00CZE85II-0 B003D7FE80-0
3867	A227JYFKLTXGRF	1377216000	B000TW2JQC B008JWW5K4 B004TP9FHG B00A51LI1O	B003QITYNC-1 B006I33WQM-0 B002RT71S6-0 B006I33WQM-0 B005EFYXLI-0
1049	A1AHHYZZVWML3Z	1377216000	B0009I4MGQ B001E7BEEE B001D0IWDS B001D0IWEC	B00DEXA0LY-1 B00198ZOU8-0 B0056VEYMS-0 B003Q33LJ0-0 B0001EKWPI-0
13571	AXQMBPM6BZGYC	1377216000	B003AKHQG8 B005P0QN56 B003UH0528 B002LB75AO B000C1Z1HE B002FQKKBQ B0045W22SW B003P904EA B005OZJYUS B000HRVC5I B00150LT40 B005V1J9PK B005Y6F4WO B003X4I7HS B004OE9RO8 B008U1Q4DI	B000RO3EMA-1 B001R654TS-0 B007WGJHT0-0 B004GT440S-0 B0001EKWPI-0
871	A18S2A07LBNVNF	1377216000	B001EWETAK B001J2ZXMI B0027CT5SC B002PBGBX2 B003F2T0M4	B002PBHQP4-1 B00B7ZFMA0-0 B0082XRJXS-0 B00390DN34-0 B000KNHJ5G-0
2323	A1NHVLB3BSRGBU	1377216000	B00150LT40 B0069YCYB4 B009CZR3Y0 B00BCMNTPS	B004YWS430-1 B0047PPO0U-0 B003PL2D6A-0 B0030TZK6M-0 B003PL2D6A-0
116	A112TFLXGBF6NI	1377216000	B00069FJUG B0000536M2 B000KZ2E54 B0046753EG B001KYO5RE B002L6NZHG B000XFSUWW B0002DNZAC B004Y9JO6Y B002R23I76 B001VD2DMI B009ERGG94 B000H3I33G B006WVCF18 B001D67O3G B001DHI0R4 B001NP5IK8 B000052Y33 B004887CU6 B007ZXR4I6 B001VD8DDG	B000052YOR-1 B002D48R5G-0 B0018RF4IW-0 B000SSG0EE-0 B000SSG0EE-0
10586	A44PQ350GTQ2I	1377216000	B001HTYJLO B000ASDGK8 B001T8M9VA B004VFXVJW	B005MIFELK-1 B0028S0V1K-0 B00068AZ88-0 B003S516XO-0 B000FBNYSY-0
11011	A8IW9RWHFC18Q	1377216000	B002XITLL6 B0091W9NEM B004X1QY20 B009NAE8RO B004X1P91C B00BI4C8M0	B0092SVTGA-1 B004NMYM96-0 B00411B4CC-0 B000KEOQR4-0 B005BF1M10-0
11251	AAUDARQ8NIGZO	1377216000	B000NLJFNY B000PNTQW0 B002QI1E9K B000AMHWCW B000HRVC5I B003XFKACM B002PBCABY B000QUKAUE B0011DS3CW	B0046VGPHQ-1 B0027TSO5A-0 B000C1Z7U0-0 B0027TSO5A-0 B000C1Z1HE-0
8061	A37ITFQMWUSVU8	1377216000	B001HYHUY2 B001RMP7M6 B0057JCYYE B003TMO3EU B003ZUTWVU	B004NJ8WFO-1 B0012RV5UO-0 B000HRXCRE-0 B001T8M9VA-0 B00361QP6I-0
9034	A3H7087YTQO9PO	1377216000	B009VGNYFM B00AYSXBPO B009FKNGRA B004N7DQHA	B001FORJXQ-1 B000UGVVHK-0 B004XGLDG2-0 B003A8EKTG-0 B006ZR92SS-0
11218	AAIRR89N7E9RU	1377216000	B00538EAAK B00A51LI1O B008U1Q4DI B005C1C02S	B007ML0OY2-1 B0045W9Y56-0 B00DQUVXPW-0 B009IROH0U-0 B001D0IWDS-0
4993	A2D8R8T4J1AIOQ	1377216000	B00BROQU8Y B00CBK017Y B004YBW5T0 B000L596FE	B00BPDFQK0-1 B004OUFZP2-0 B000RRKCVS-0 B00469CIMO-0 B000OYHN2K-0
198	A11ZA31I1KIIZ1	1377216000	B006L1DNWY B005C1C02S B008U1Q4DI B005C5FP9Y B00683JILU	B008FOT6U8-1 B00385WMK0-0 B005N2ZLHW-0 B005N2ZLHW-0 B004CQR9L6-0
9177	A3IOMA6R9GW9NS	1377216000	B001MA5RKK B000C1UEZI B0020MMCJI B000C1Z6TC	B000C1W6TK-1 B000V09TVK-0 B0024WDWU2-0 B003VMXSIK-0 B00C8G2VLK-0
11073	A9298U7GYVQG4	1377216000	B0046VGPHQ B002HSWFWY B003Y04OK0 B00005A9WP B00CBYAP0S	B000PP15L8-1 B004Z67NSM-0 B003RF82RI-0 B006NYDUBS-0 B005OZEFKM-0
2293	A1N5CXTTTBYYK8	1377129600	B0030HAF4G B00BLF99H8 B001JKTTVQ B005OZFV50	B005OZM810-1 B000GZGT3G-0 B000V2F6BU-0 B002LE54P4-0 B0017QT5UM-0
10535	A3VPXRR9JQ4UC	1377129600	B003UA5HCS B00683MOWK B0082D69H0 B0039UT9QE B00BM1WKT0 B0061KQF2K B002DP75R6	B000WYZ9Q4-1 B002BFPDCC-0 B004T3K54U-0 B001EXJPIU-0 B002ZNJI94-0
7660	A33C8JLZJPUX3	1377129600	B002TPQPEE B0046VGPHQ B004O752PI B004WSXD4G	B009Q1YPV4-1 B002LFLRFY-0 B000TTPZQ6-0 B00016WV6E-0 B002BABHZE-0
852	A18NQ4APOLHFTS	1377129600	B00170F6A6 B001544IQW B002WTC38O B001P60R0Q B0013OJUWQ B000Q8R7KW B002PBCAEQ B003FXCFZC B00168538E	B004FUUMJK-1 B001QX7NTQ-0 B005UL1B34-0 B00AMYORHQ-0 B002B46H6Y-0
10584	A44ME9RX5N1DN	1377129600	B0030HMQTS B003QUONE0 B001JQLNNW B001E96NHK	B002QI1F8A-1 B0009TNBVC-0 B001G7GR5S-0 B0067YU1ES-0 B005OZS5TO-0
2735	A1RJUXDK64O91A	1377129600	B0009V1YR8 B000VTVD6A B001V9LULM B006WVCF18 B000CIBVP8	B002KPWZPG-1 B005O54SVS-0 B001MTFMPG-0 B00BAVOZYK-0 B005O54SVS-0
7804	A34T2GZM0U40O0	1377129600	B001GMANIK B001ABLKK2 B0009HJBPE B0009DVDTU B00164FKWW B007FAOUOA	B001P7AWXC-1 B003X18NPW-0 B002PBAJ4Y-0 B0045W22SW-0 B003X18NPW-0
1835	A1INBQLNQNSHTK	1377129600	B000G014Y0 B000FKGSJC B001E763NQ B0073P01RC B0094C43FI B009XRF9M0 B00AY90J1C	B00DQG0PJQ-1 B00B840UKW-0 B004Z67NSM-0 B000SSG0EE-0 B006X1KROY-0
7715	A33W4M1SMV6NDK	1377129600	B0067H6FW2 B0055Q6MYM B00198ZPU2 B00997YO52 B0090ELFQK B0009M0C5W B001EWF3GO B000NE6PCA B005YB36RY B008USRW4Q B004WC2H8A	B002RW9C3A-1 B00AU82TP6-0 B003RD1MV8-0 B0046HIP1Y-0 B006MMOVOQ-0
2254	A1MQX1OCJWC9AE	1377129600	B0014LLC3I B001P7AWXC B001BBB18C B000PU70WG	B000ALFROS-1 B00528M5IU-0 B004D281CK-0 B0000YV6YK-0 B008CT12G2-0
12370	AM2ZMWJO4EHEZ	1377129600	B002R23I76 B0068Y0EXK B008R56PVI B001UREIFU B004LXHEX8 B002OVV7F0	B007Q22HMY-1 B0062GZB4Q-0 B0050CCQK0-0 B003TO3UG0-0 B004W55086-0
6005	A2N2CUKVYEZLW3	1377129600	B0017BGQR2 B0086LC0WG B008RTNSJQ B0083QNBCM	B0056FL4FY-1 B0009EXMB6-0 B00A8WQKAO-0 B0009EXMB6-0 B00C8GBZAS-0
11074	A930TA3RDIJRS	1377129600	B0032PQPWW B005C1C02S B008U1Q4DI B00761YIQ8	B0076D1YF4-1 B0010P55I6-0 B00027DMSI-0 B00B7ZFMA0-0 B003XUMQ56-0
4837	A2BRF9S4ZT16OG	1377129600	B001KYO1QO B005DJ25Z6 B0031ZV8OS B00150LT40	B002QF4UYY-1 B002GOXELA-0 B004ITB3IW-0 B004SSDH6E-0 B000FCNW26-0
13100	AT29CACYTJKYX	1377129600	B006J6R23M B004ROW4ZO B007ZXR4I6 B007IUPZJG	B00APV7OWG-1 B007XA49O8-0 B004FEO38C-0 B006ZENPYS-0 B002P3L99G-0
11777	AFS5ZGZ2M3ZGV	1377129600	B00198ZOU8 B003H0U5BY B004Z40048 B002UU9Q6W	B002X9XV48-1 B005IUKUAC-0 B0047F9820-0 B005UKZAJG-0 B002HPBF32-0
13029	ASG3WG0B8UOTP	1377043200	B0013TM9UQ B00387F426 B00BGBUQXS B004OXE1KY	B000YJ2SLG-1 B003QITYNC-0 B003B6S36S-0 B002WTC37U-0 B00B3MGWTM-0
11554	ADSFKIX44X8JV	1377043200	B000FBNV1Y B003156NFW B004D268RA B00014EKJC B000L596FE B0015IW3PG B00120XR0M B0094C43FI B00DCNBST4	B00B1DRA94-1 B000RO3EMA-0 B000RO3EMA-0 B004HXXO1I-0 B008BJ4SR8-0
12658	AORGKBNQZ83O8	1377043200	B000GUZ8HY B001D0IWEC B001J2ZXMI B002IDPHBE B003P904EA B001LF4G7G B008CT12G2	B008FZ562E-1 B006UETRWC-0 B000C1VT3Y-0 B000X315P8-0 B005Z4QT7E-0
10997	A8DTTZTQXD0H1	1377043200	B001AGC1NW B002QF4UYY B000F35R00 B00008J2XQ B000QUM5LG	B0002JHI1I-1 B00005NASR-0 B0002YE8WA-0 B000050B6U-0 B000I5MJ8S-0
9915	A3PUVT9HWURYNM	1377043200	B0009R5CMK B0030F2X6G B003S516XO B0055E1UCI B002R23I76 B0019N6RFO B002MZ8BK2 B003ZW2M5Q B000WE1PP8 B0032K5LI6 B001T8JLRK	B001MBLAKA-1 B000IXPFY0-0 B004SSTOCK-0 B001DI776S-0 B008B4FKLG-0
11878	AGVPJGF95VSME	1377043200	B004CZSVZ0 B004I5DFYQ B007MXNCGC B0039W0UOM	B000VDUOFM-1 B0002YE8V6-0 B006UETDGC-0 B00502NMTE-0 B0016O92XU-0
3169	A1VXU7UBSHHWB0	1377043200	B000GDF48Y B003NXM9HS B00203KPDC B004UMYEIS B001CL88QO B000G666QK	B0046ZOWJU-1 B000Q8PV96-0 B006RHYSLM-0 B003H8E7SS-0 B0073KABJ0-0
6685	A2TQ2SZJK9CRFA	1377043200	B007KNAA2S B0092SVTGA B003IX36H0 B004YWS430 B0046MK34G B00AMYORHQ B001ZD3DHI	B004K9JPG2-1 B000196U04-0 B00884GXE2-0 B0016836RY-0 B000V6DMUS-0
3436	A1Y91AXTNDEIWW	1377043200	B000AADF0M B001TAIFZM B000VDUOFM B001IAE1BU	B002RUH3OM-1 B00129XP8M-0 B003E3IOPS-0 B00129XP8M-0 B001AWVR5O-0
10244	A3SXO5CFZ28FGO	1377043200	B001U6FIVE B004FQGLQC B005HIH7YM B00176VZB4	B007PQYHJW-1 B005XY43IS-0 B005XY43IS-0 B009A9LBL4-0 B00699IIW8-0
2417	A1ODIGUOMK33G5	1377043200	B0009V1YR8 B007HTSVAS B0046VGPHQ B000HRVC5I	B003KNQ8OQ-1 B0046VEREY-0 B0009RF9OG-0 B000QV2I4E-0 B004CQR9L6-0
9427	A3L829BHSRRJ7U	1377043200	B006J44ICC B004ITB3IW B00AMYORHQ B003N4RGIO B0088JJ7YK B000RY5YY6 B0068Z7MT8 B006U98T08	B004JZT328-1 B007P7Q4Y2-0 B00008J2XQ-0 B004SSFE8S-0 B001G0W96G-0
8852	A3FG2MLHBMYRU4	1377043200	B000142C1A B002DMK0LC B000PP15L8 B002DPUY5Q B002QI1F8A B001KYVLSU	B004LCD8D4-1 B001EWET96-0 B00385WMJ6-0 B004FUUMJK-0 B00385WMJ6-0
2851	A1SNUQMWMH021L	1376956800	B002HEW7QM B002X9XV48 B002HEW7V2 B004BUDK6G	B00A8M0ARI-1 B00021B95W-0 B0070TSNO4-0 B0043TUSME-0 B0048F38DY-0
7572	A32HV16F10BGU1	1376956800	B007PG783Y B000OYJ9AO B005KL2IAY B003N21THK	B000GG2HOU-1 B0011UR1H8-0 B001T0HHDS-0 B00CQ5C54G-0 B000TTPZQ6-0
7455	A31A4VYY4IVAJ7	1376956800	B000JL7Z5S B007LANY2S B00BX7DGIC B006UET5UG	B00AQ9JIDK-1 B0028SVO98-0 B005KJ353U-0 B002DP19ZU-0 B000RSJKTM-0
4094	A24FY1EBJ7EWLH	1376956800	B003P904EA B004LEJ8R2 B003OH07G8 B004SY3X4Y B004SY3X3A B0013JHGPO B000NW4LDW B0012K3RFM B002LL57Z4 B001CJE0MC	B00BXL10Y0-1 B000YTGT6Q-0 B00161607O-0 B001U3QTRO-0 B0009EILKS-0
1724	A1HI1C8EM9K6RI	1376956800	B008Q0E714 B0082XRJXS B00B840UKW B006OMHR1S	B004DK0UDA-1 B0067YU4KO-0 B001GZUJ1I-0 B004BCXAM8-0 B0026I8M72-0
12829	AQG46REBK2I2H	1376956800	B000VV1ZMU B000ALDLJG B005P0M69I B005356O34	B005OZM810-1 B0094X5X92-0 B0006LNJ56-0 B0077S35WS-0 B002PBCABY-0
1437	A1EOOM1EWVSSA1	1376956800	B004Q8GYES B000ZMBSPE B003E84PQU B003EN4T2U B009CS493U	B00128WK4I-1 B009S99Z8W-0 B000YLFHPS-0 B000YLFHPS-0 B006X2IMGS-0
513	A15DJ0R0IVSYUB	1376956800	B004SSM396 B003VMTZ8C B001RMP7M6 B003ZUZCDC	B00469CIMO-1 B00028OTNY-0 B002D48QIE-0 B00AU8SXII-0 B000VUYHSU-0
9291	A3JO80BUDWGWD2	1376956800	B002ZBBX4O B001AEQ9CI B000052YM7 B001MS7HF0	B000TNQVPG-1 B000HZEKDG-0 B0034UBI40-0 B004YVDIAU-0 B009GIOVKC-0
3765	A21DFMX3J51CQ4	1376956800	B0068DF82S B006KXA7EU B006FM3UVS B009GYVMAS	B00B7MUJR4-1 B002C0338W-0 B0009RF9OG-0 B008A3WGTM-0 B002C0338W-0
8465	A3BEJ9UVJMENK2	1376956800	B006OMHR1S B002H9L62I B005VX8S4G B003ILUQPM	B008AMKZUU-1 B0023A7JF4-0 B000URVDRW-0 B002PBEDT6-0 B005HIH97C-0
3843	A222XUSQUPQUD2	1376956800	B003CTU5MO B007ROCY2O B000KQB1SY B0013TM9UQ B0007X74E0	B0028SVO98-1 B000H8UN3Y-0 B00AV1IJME-0 B006Z8BN02-0 B002LA7VR2-0
9694	A3NQB1LZYFBGB0	1376956800	B001PNO6KG B0086LC0BW B003JBGMZ4 B0084BPHY6	B0053L2E1O-1 B004AIAVYS-0 B0018SAJAY-0 B006WZ9N00-0 B004NMVP82-0
5716	A2KMJQDD5WN2LL	1376956800	B005V2LLXC B001D3K6U2 B008EDAZCI B00AJG8JOY B006UMU4NK B0083QNBCM B0084YYW2Q B0078VJ1OK B004LXJU5I B0019N6RFO B005C1C02S B005K1UULI B008H42554 B008VE6PJC	B008FOT6U8-1 B006RFZ66K-0 B000AM82US-0 B0009N35D2-0 B005JFPGX2-0
9568	A3MJ1HZELN5FLM	1376870400	B0010XUU9M B0000535RA B004WC2H8A B003FBG7UI	B009GEUPMY-1 B001IACZEK-0 B0009STDD8-0 B00068AZ88-0 B004W55086-0
9072	A3HIDCZOYWOYW9	1376870400	B007HSP5GC B0084BPHY6 B00871KNHO B001KYO2M2 B008U1Q4DI B007WL2UL2 B0076D1YF4 B006L1DNWY	B00A73ZCP8-1 B000JI9JYQ-0 B002PBEDT6-0 B0071HIDLS-0 B000EH0NEC-0
13091	AT08ZTZS42UJD	1376870400	B007PG783Y B003FBI9LS B000GX4BSS B00005O0MZ B001QTW2FK	B000T55RSG-1 B003JT4S7U-0 B0039BGHW2-0 B0039BGHW2-0 B00BAVOZYK-0
11795	AFYUFB2NF1CMJ	1376870400	B0015SBOLU B005SHT1KK B005SHR4LS B00A1Y177A B006L1DNWY B005Y6F4WO	B000BVCSP8-1 B000PK4XRQ-0 B000Y1JT8E-0 B000052YP6-0 B000HLH758-0
878	A18TLJ8PZ4KYE5	1376870400	B000PI36W6 B005D0WXPC B000NCTQV4 B001CY87TE	B0036IV7MS-1 B008DUCG7E-0 B000I20Q72-0 B008DUCG7E-0 B004BUY5RY-0
9324	A3K2RYNRVRKI4H	1376870400	B000ZMBSPE B003XKW8RM B0019LWU2K B002DPUY6A	B004K3D0FK-1 B0089GNP7C-0 B009JVVRK8-0 B000EVGQ8U-0 B001JK6PKE-0
464	A14QJKY3DA19AP	1376870400	B000136P7S B0009RFB76 B002BWPXGQ B000Q5UOZU	B0043TUSME-1 B003I5SC72-0 B00AU8SXII-0 B001MW38KY-0 B002WLWX82-0
8851	A3FG0NCUR22PRF	1376870400	B00027DMI8 B0012XO2W6 B0082D69H0 B003JTCYH6 B0012ILUC6	B008H1IDKI-1 B009NQEQUC-0 B0055E61KY-0 B000E7YL1I-0 B002SIIFRC-0
9297	A3JQ8ZYMP62GZ0	1376870400	B000F63TW0 B001PUR1GK B000RSJKTM B006Z8BN02	B004K3D0FK-1 B001A82DY2-0 B008VDLAIE-0 B001PNFFLK-0 B0094C4XOO-0
13352	AVLCKO0ZI8AG	1376870400	B000HRVC5I B0002YE8V6 B004MKNUAG B000HX2LDE B001UHN0I6 B000RLXG6W B00356UHT0	B00143S6YO-1 B002BFY9VS-0 B000CNIHEG-0 B003VN1ING-0 B003VN1ING-0
545	A15O192EI39W4V	1376870400	B005XG2P0Y B003S191LC B002GOXELA B000GCHKKK B00375L8JC	B0091W09SG-1 B004HSO124-0 B001CTUX5K-0 B00A2Y2RQ4-0 B0054QHA26-0
10010	A3QRVBJQIA5G21	1376870400	B001DOA73C B001KYO1QO B001H9289Y B001H943F6	B001N5FRWW-1 B0068Y0EXK-0 B0034KYDSS-0 B000VUYHSU-0 B00BKUHK98-0
11903	AH3Z19P6TJD52	1376784000	B00021CNCK B001OMI8ZM B0067H6FW2 B004TTXMQ2 B00AVWJQWK B0067YTMMA	B000VUT3O8-1 B003XWG880-0 B00634TG48-0 B0015XNAS0-0 B0000AJ3Q3-0
4035	A23SJYWQ8IEOJA	1376784000	B00008MOQE B0000531GD B009FIF1RU B004WDV2XA	B001KYQ4HS-1 B006QFCDDK-0 B0089VD8WO-0 B002WTC37A-0 B005G5DXWQ-0
11577	AE1UMHN3TU6NA	1376784000	B001UREIFU B003W5KDFW B0027SXG9K B001KYO5RE B003LA90RU B004SSRSRS	B003VMZTCI-1 B005OZJYUS-0 B000PR4F9K-0 B000177FXW-0 B008QDUO68-0
2184	A1M707ORDR92AE	1376784000	B006UET5UG B0030HKJ8I B003RCZSJ6 B001H928HQ B008JH1CB2 B009K7X26I B004BCTBAS B009K7XLK0	B003QUONE0-1 B002QA52V4-0 B00B1DRA94-0 B002KDNN86-0 B00CZE85II-0
13323	AVBTE32AP5HWF	1376784000	B00467AXL4 B003Q3RUTM B004ATTGSY B0000UJJH0 B000PHUKEE	B004LUVN10-1 B0094KPK70-0 B00AVUE1S6-0 B0018C1FKI-0 B004TI3BKK-0
1951	A1JOSG34UV7LK7	1376784000	B000TAA9Q6 B000OYHN2K B004LV82JU B000JNRIM6 B001390336 B000I1OYNK	B000R92XIG-1 B005C2NBC0-0 B005C2NBC0-0 B009ARXD7Q-0 B005C2NBC0-0
9952	A3Q57F5ROZTEQT	1376784000	B002WTCD8O B0050INH2U B004TSFE28 B005BXEWOG B008LF5U7E B00A51LI1O	B000VOPALY-1 B003COAFPQ-0 B0002JGIZA-0 B004ISU5V4-0 B00A4F86KC-0
11916	AH9AUW175XCVP	1376697600	B004799QZA B004Q8GYES B0067H6JCI B0063A432W B004X8KP9Q B009FKNGRA	B00AYOHWQW-1 B00D0ANSAG-0 B000142C1A-0 B002DOO1VA-0 B0047AKVW6-0
13011	ASAMQXSH23HAY	1376697600	B003RF82UK B000BTO6CI B00AREI3S0 B004D24818	B00AZIZJIA-1 B000A3V1XC-0 B004SZ4KTK-0 B000052YN7-0 B008CEDY5O-0
5180	A2F58ZQXB43H94	1376697600	B0009V8N5E B000CST4FC B001FYV0HM B000RYLN6O B0000530ED	B002B46H6Y-1 B0011DL6R6-0 B001AL2CNG-0 B0012BNVE8-0 B00CM7YTO2-0
2557	A1PSDGYU39C2H0	1376697600	B004YBW5T0 B0053L2E1O B0036LMFYO B004IUN7JO	B003PFBCTU-1 B00361QP6I-0 B00361QP6I-0 B001841FKQ-0 B0094DH1RE-0
649	A16Q479PYT0G6N	1376697600	B0047F9622 B005H1525A B00AD9R6DM B002F07RA4	B000ZMBSPE-1 B002T5IN5I-0 B003M5UOBK-0 B003M5UOBK-0 B002T5IN5I-0
12455	AMV5LTL0B1UBD	1376697600	B001P1ZEL8 B001392TJM B005OZTE7Q B00027DMSI	B000VB9YEQ-1 B005SPETHW-0 B002WTC37A-0 B007DGRT3K-0 B009A6D04I-0
11753	AFL54V7707SZS	1376697600	B00373OK3A B005C48WB8 B002CL84FI B003RF82UK B002R23I76 B00373FPG6 B001G7PLOG B000H3I33G B006UET5UG B004X1QM9K B002NBJAWI B008532UV6	B00AP1BTZE-1 B005HJ4474-0 B0000ZHOEU-0 B00B8U6F6E-0 B009K7NA1U-0
55	A10BK26EN1YSZT	1376697600	B000JGKG2M B000SSG0EE B000Q8R7KW B000OO7546	B004V65RMU-1 B000BD0SEE-0 B000QURQQU-0 B007BSA5ZO-0 B0013LN56G-0
5610	A2JI40JZX9W6J7	1376697600	B007OU499W B003UH0528 B0011DGH0C B000O5RVJO B000HRVC5I	B00150LT40-1 B002WTC37A-0 B004XJNQXW-0 B002WTC37A-0 B001AL4DBA-0
12433	AMP6GGLHAHDAE	1376697600	B001VHZXOE B000052YM7 B000052YM4 B001E8WBP4 B000052YM3 B00CDTHC6G B000VF023E B0009ET5JE	B0000535OF-1 B000X040QW-0 B004T19R3W-0 B001TP0A8M-0 B002ZNJI94-0
13772	AZZZLM1E5JJ8C	1376697600	B006ZUEMSA B00027DMSI B004CQ710U B000QE5GU4 B005XP4YNQ	B005RFI1YK-1 B004BCVD4A-0 B0020MMD0G-0 B00028PFF0-0 B008JWW7MK-0
5881	A2LWUWT4UWX0L2	1376697600	B0009MHJS0 B0009ML5M6 B000VOP79O B000VOLCPC B000WUD83E B002XITX8C B00433VGVW B001M9HXDA B001U3QTRO B000F8JUJY B006QB2VOK B0062W4T98	B005356O34-1 B0017QT5UM-0 B000VRTE9A-0 B0046OFO3Y-0 B004ULUVU4-0
12246	AKP50DUJHF675	1376611200	B007Y51LNE B005FYJB92 B002L6NZ6C B0000530ED B0068Y6CA4 B000RGZK02 B0013TM9UQ B001ADQUWS B005TKZS76 B00127C83M B003VRC12O	B002B4O7XE-1 B004E79EQQ-0 B006YIUK98-0 B004ZH5MTS-0 B00142C8KS-0
11879	AGVV8D8J4IGRK	1376611200	B001ET6Y4C B001TAIFZM B004PBKD8Y B00170E81O B001QT5FMM	B00397XUIK-1 B00006JN4F-0 B004JSGF4O-0 B004JSGF4O-0 B0002SA9BU-0
1648	A1GVDV6X6JPH3D	1376611200	B003S516XO B000ODNSR0 B006VX5RQW B001ET7IWE	B0067H6MF2-1 B005FYTGYC-0 B005LR8KY0-0 B003IU9HI0-0 B003YEWHH8-0
11057	A8WEXFRWX1ZHH	1376611200	B001E6R61U B000ODNSR0 B0027CT5SC B004D24818 B0000UTUW4 B004PYL4NE B0001TQ9WI B002LMBLTY	B0000UTUVU-1 B000GHVCM2-0 B002F17ZXW-0 B0089VD8WO-0 B0089VD8WO-0
8276	A39IMN6G6UZJOK	1376611200	B003ZUZCDC B003VMZTCI B003VMZRYI B003VMV7D8	B004T49ZEK-1 B000EVGQ8U-0 B003CGTKUK-0 B004ZD2M6I-0 B004QLOFTG-0
1786	A1I5H4MPV1RCBE	1376611200	B002L6M068 B000ODNSR0 B001ADOV4W B000G33KEO B00AQ8NIC8	B001KYVOJQ-1 9759091062-0 B0038TYTI4-0 B000PZ8E62-0 B006BD93M6-0
7019	A2X3L31KCXBHCL	1376611200	B000UPXU2A B000VPPUEA B000Q6V1UG B0063A432W B00535OW6A B005TI7NQW B009XRF9M0 B00AFBSIPI B009VGNYFM	B008FZ562E-1 B00411B4CC-0 B00147FGJ8-0 B000052YKY-0 B004DN8F4S-0
7773	A34G87W2OFHQID	1376611200	B00CJQBTJE B0017ZDH52 B0083HT86E B00AZBSPQA	B006L1DNWY-1 B008WG7X8Q-0 B0000C0XL8-0 B009IROH0U-0 B008B4FKLG-0
3389	A1XU4YJ6EWD8OH	1376611200	B002VECKGU B00112AH36 B0026P3GVW B004O3UIT2	B001KYRWP6-1 B000VJ7PC6-0 B007O7AZ3O-0 B0006PKGJY-0 B008532DIG-0
11686	AEY62S6LDG8QV	1376611200	B003GC4GH2 B001I6RW6U B0041FDD2C B002KIGXIS B002XXB5FG	B001W2X8AO-1 B001FYZTEW-0 B001CL2L6M-0 B0037ZA4GU-0 B0045W9Y56-0
3543	A1Z59RFKN0M5QL	1376611200	B0067F8BBM B005P0QN56 B003F2T0M4 B008JWW914	7806397051-1 B002B46H6Y-0 B005U33DO2-0 B002HK2GWG-0 B005T306QG-0
6643	A2T8AA3D2KAYTU	1376611200	B007E2K41W B0058E3XJI B003KZBI30 B003FBI9LS B002Q6UK9M	B000TKH6G2-1 B008CT12G2-0 B002BABHZE-0 B00BSU7H5W-0 B000EA2M3E-0
2617	A1QI9EPP3LGXRE	1376611200	B004DIZZH8 B008JWW5K4 B004Y9M81W B004DIUWY4	B00A51LI1O-1 B001MS7HF0-0 B004JZT328-0 B006W1BSD4-0 B001330XFA-0
10780	A64VV64H3KKYQ	1376611200	B003B6S36S B003GDK6F2 B004V9QP0A B003TZFS1Y	B000V9M8B4-1 B0042X83UA-0 B006MRM2TW-0 B000196U04-0 B00AZ0FJB0-0
9343	A3K9LSAB4K21EV	1376611200	B005G5DXWQ B003VN00YY B003VMZYSC B004LEJ8R2 B0012K1R3G B005MG86TY B003OGT4KE B009GMYMQ6 B00BCX7KUC	B00BCX34YI-1 B000X315P8-0 B00027DMSI-0 B003O4H2L4-0 B008NX5AGK-0
2645	A1QQB7U76YWOO4	1376524800	B001AATJZG B006K26D9E B001ADOV4W B001UREIFU B004TSF8R4	B008LF5U7E-1 B006ON74II-0 B00166IQ6W-0 B000V9M8B4-0 B000R92XHM-0
7136	A2Y86NGI9SXBHM	1376524800	B000HHOPDE B003OGQYC0 B003OGUQS8 B0002Z8QHW	B003OGYO7W-1 B005BTCPRG-0 B003VSDR7Q-0 B003P904EA-0 B001OMI9VA-0
10936	A7RW1NI85WDSE	1376524800	B004M7WKKK B003RCZSJ6 B001MV5TX4 B002ZTV9SG	B002QFGQAK-1 B00AZBTUNC-0 B00028OPZ6-0 B00028MLHA-0 B0010XUU9M-0
4675	A2A8IY4GTR7GWQ	1376524800	B0018S8MZ8 B004D268RA B006ZA0A5Y B000H8UN3Y B005KJ35D0	B005HIHD2I-1 B0019N6RFO-0 B008STA7IK-0 B0018OWHQM-0 B000YJ2SLG-0
2535	A1PNEJ2IXHE6JM	1376524800	B0015XNAS0 B001H54VJI B001189I3A B004I24AMK B000XFWO10	B00AVUDDC6-1 B0023ASBSS-0 B002QI1E9K-0 B000Q6V1UG-0 B000EH0NEC-0
11082	A95H45Z6ZO4LG	1376524800	B005EFYXLI B0052GADTK B00B1DRA94 B003QUONE0 B001TOSNSC B004LXHFH8 B004M7WKKK B004PKAMTU B006UET5UG B006UETAB0 B001H928HQ B005OZJYUS B002R23I76 B000U0F9GA	B006R1LBJA-1 B00BCMNTPS-0 B000C1UF3Y-0 B00871KLRQ-0 B00AQX87M4-0
10536	A3VQTONR685S54	1376524800	B000O7JNC0 B000HLRP7S B000YL8NOK B000BX1Z00 B0009R33U8	B00129XP8M-1 B004BIZ69W-0 B004V6BIZU-0 B00AUFSOU8-0 B00064H44K-0
12445	AMSZXR1PDP3NS	1376524800	B0084QNDWO B002U774PK B002XITLL6 B004C7OISC B0077CNO1G B000PNTQW0	B0062MB95K-1 B0034RNC7E-0 B002WJOOIQ-0 B00528M5IU-0 B000HGIQRG-0
3379	A1XQFWZJBKLEER	1376524800	B0012NVE2W B0006HCE60 B000U2AQNY B00016WV6E	B002RXK1UC-1 B0002QB1SC-0 B00C2AYH3W-0 B003STPN4S-0 B00AZIZJIA-0
10649	A4Q3EC84QXJFB	1376524800	B000OBJG6Y B005TT8UJK B005TT8RPM B000TKH6G2	B00937VAQE-1 B005EFYXLI-0 B0042WIHNY-0 B00DQ2IMVS-0 B00DQ2IMVS-0
1527	A1FOB8BGG5AMG2	1376524800	B00AXL7YH8 B001MX89Y8 B000052ZB2 B0090UJFYI B000O5RVJO	B00C8GBZAS-1 B002JSL6QI-0 B007PQYHJW-0 B00ACB6H9A-0 B002QGO5YS-0
1504	A1FFFEHK9K5XU0	1376524800	B0009RFB76 B0028P1S38 B0074ENPWA B000QE5GU4 B008PK5NRC B000PBQ7LK	B000XZSVQC-1 B007L5H7XK-0 B0018HH444-0 B0028BKV4E-0 B003LA90RU-0
4858	A2BZ16RKE13PKV	1376524800	B0009V1YR8 B005TI7NQW B0068G8DTA B008U2Y9BQ	B009FKNGRA-1 B000FSG2Y0-0 B002D48QNE-0 B00428DLCK-0 B005XIDZHO-0
1264	A1CS786QORAT4C	1376524800	B00107BB82 B003EUR1D2 B003EUP3O6 B008AGWMEI	B005FVSH0O-1 B002DPUY4W-0 B00641UCY8-0 B002DP19ZU-0 B000P275OM-0
11834	AGCO9QUESLOQV	1376524800	B002D48R2Y B000BIXP30 B000FCY95A B002D48QWA B004530AB2 B0014KQSE2 B001CJE0X6 B003SZQ8SC B001CJFEYK B004I5RU2Y B001MF0V3S	B000X1HNUG-1 B004NYTR8U-0 B0006GZAKI-0 B0083JDFY8-0 B004IVM0EG-0
6038	A2NCBOY85INJ9B	1376438400	B004X8KOEC B001DOA73C B002CL840S B008532S7W B007Y2IM70 B009ARXD7Q	B006U98T08-1 B004L5HPGC-0 B002TPQPEE-0 B006OMHR1S-0 B002SPVA7M-0
6833	A2V9FPBJYNED00	1376438400	B000142TU4 B004NYZ5AE B003G0S7S8 B000C1Z1HE B000ZLVUYO	B000LGNQPY-1 B003RF82RI-0 B005G5DXWQ-0 B001DJDP7C-0 B00910ZHJE-0
1767	A1HZDB71QQN6Z7	1376438400	B000EVEKMY B000AAAVTU B0043IX95I B004O3ZPAO B006WZ9N00	B002K8W58K-1 B0009STDD8-0 B004NYSL9Q-0 B005MF19XU-0 B002HSWFWY-0
10919	A7M2PR1AN8MQR	1376438400	B004BCT93C B001AN0UTC B003UA5HCS B004FM6M2O B0009OAHIM B006B7XHMY B0018OVKQ0 B003F7WQGQ B000VV0JNQ B0000530ED B000OYJ9AO	B000127UVY-1 B001EJOPV6-0 B000NWGCZ2-0 B00006FRW7-0 B001N9MEFG-0
10695	A58I5AEY3T1QZ	1376438400	B001EM8MNA B0013CSGBE B002XHACTM B001715WH2	B003EUP3O6-1 B003ZS6OJK-0 B008PQ5YC0-0 B003ZS6OJK-0 B000XT89S8-0
8975	A3GLRJH9NOIZK8	1376438400	B000S8JB68 B006U98T08 B001UREIFU B005FYJB92 B002QXINAS B0030O3VRW	B00AZBWA5W-1 B0032PQPWW-0 B008HODSNW-0 B0069UA4GK-0 B008HODSNW-0
7942	A367YF0EJSHVM3	1376438400	B000VDUOFM B002WTC38O B000142C1A B003RFA4QA B003FBMFMC B000C1UBFG B006NYDBKI B0045H854W	B000KFX23M-1 B007S0CM2Y-0 B003COAFPQ-0 B00ANFYEQS-0 B003COAFPQ-0
1146	A1BKSLDI2V3D5K	1376438400	B0036QQWAC B0018209PU B001FYXA6G B00373FPG6	B0050CCQK0-1 B005P0M69I-0 B002RTVQNW-0 B000PI9MO2-0 B00198OG7U-0
63	A10EO39J34O6JN	1376438400	B000VDUOFM B00CM6Q6X0 B00CIUZ3BQ B00CWDBMSM	B00CJ1YFZY-1 B007WW1AOE-0 B006ZAPMT8-0 B007O7AZ3O-0 B0019N6RFO-0
4890	A2C7NJ7PQXHECJ	1376438400	B004TTXMQ2 B004JHOJN4 B000GDA04W B002CML1XE B000T7P0KO B00B99O5WK B004WSXD4G	B007N19DDE-1 B00120U5E8-0 B004AIAVYS-0 B0000535CH-0 B001CTUX5K-0
965	A19VI7S7I6XIHD	1376438400	B000VW7P3W B000OV3ZDO B00174GJC6 B000F6Y55A B001E919LU B00027D6SE B00006IGL8	B005IJTKFY-1 B001U23VB2-0 B0029ERWH4-0 B003LYDBCG-0 B001E96P1E-0
4633	A29TOAKX6YP8Z2	1376438400	B0057WJ264 B005OZJYUS B005V1QLUG B0045W4X16	B004ZD2LIW-1 B0039UT9QE-0 B0073ANH14-0 B0044TNORO-0 B009CS493U-0
4547	A28UT2I4FVQEQF	1376438400	B002M0720M B004DIZZH8 B005E3LWDM B005UL1B34 B0073OC9S2 B003AKHQG8 B00ANTDQL8 B00ANTYSY2 B004QRX6U4 B008RTNSJQ B008PTPSF0	B00A2Y3LD2-1 B001P1ZEL8-0 B000VBDWQC-0 B0039KOL1W-0 B000REOEYM-0
8632	A3D732EQ36IHO8	1376352000	B001A3ML3K B001GGX0EK B00005R1H2 B000052YMR	B002LB75AO-1 B0019I83N8-0 B003VMV7D8-0 B000CI9XGM-0 B009Q1YPV4-0
